id	created_at	retweet_count	text	user_id	user_name	user_screen_name	user_followers_count	user_listed_count	user_statuses_count	user_friends_count	user_favourites_count	user_location	user_desc	user_created_at	retweeted_status_id	retweeted_status_created_at	retweeted_status_retweet_count	retweeted_status_text	retweeted_status_user_id
993811370998222848	2018-05-08 11:14:29	0	RT @SCS_Disputes: China might have deep pockets to buy up the world, but there is one thing that it still cannot buy. Chinese culture is y	342159931	Gabriel Chamyan	arboretumlvr	81	1	12745	441	11447	Florida, USA		2011-07-25 15:43:32	993676041011933184	2018-05-08 02:16:44	3	China might have deep pockets to buy up the world, but there is one thing that it still cannot buy. Chinese cultur https://t.co/GOHPKj65Oc	800883578770857984	
993826936328785920	2018-05-08 12:16:20	0	RT @jordylancaster: If a teenage girl cant wear a prom dress thats from the Chinese culture then non-christian celebrities sure as hell c	261867884	Caelin Mills	CaelinMills	758	4	59532	319	34938	CLE  DC	Multimedia Journalism  Political Science  Graphic Design  Kent State University  Opinions are my own	2011-03-06 21:39:23	993717524436078593	2018-05-08 05:01:34	23	If a teenage girl cant wear a prom dress thats from the Chinese culture then non-christian celebrities sure as he https://t.co/yArBnTJY6J	1488170760	
992354869779415040	2018-05-04 10:46:52	0	RT @daumkeziah: To everyone causing so much negativity: I mean no disrespect to the Chinese culture. Im simply showing my appreciation to	4402525160	ICHIRO TANIMOTO	ichitanimotodnb	570	0	27501	2444	16229	Sendai, Japan	Junglist. Asian. Formerly @AppleMusic @TOWER_Shibuya | Tokyo born Sendai based via San Jose, CA. | https://apple.co/2KxUReT / https://spoti.fi/2HQ0Vho	2015-11-29 20:35:48	990255923598786560	2018-04-28 15:46:24	9671	To everyone causing so much negativity: I mean no disrespect to the Chinese culture. Im simply showing my apprecia https://t.co/ByvuZ2b9VN	2842576303	
994308958360829952	2018-05-09 20:11:43	0	RT @daumkeziah: To everyone causing so much negativity: I mean no disrespect to the Chinese culture. Im simply showing my appreciation to	1107651372	Joanne b	jodiebbartlett	369	2	1285	284	6826		sc|| jodie_bb Ole Miss 22	2013-01-21 00:30:33	990255923598786560	2018-04-28 15:46:24	9979	To everyone causing so much negativity: I mean no disrespect to the Chinese culture. Im simply showing my apprecia https://t.co/ByvuZ2b9VN	2842576303	
994098756470665216	2018-05-09 06:16:27	0	@RickMarineGrunt @thetokenone @RondaMarie @irmahinojosa_ No you didn't appropriate the Chinese culture... General T https://t.co/W8pXS93fTO	28507193	Carole Brown	TheatreGirl79	646	45	73034	775	1943	Chicago	theatre, writing, and coffee: what more could a woman want?	2009-04-03 04:57:50						
994483931788464128	2018-05-10 07:47:00	0	RT @maryamhaidar_: Someone tell me why a white girl misrepresenting Chinese culture got verified and famous but a fellow brown sis who reps	2538369181	M	Murvel91	940	8	13653	1900	8933	Hogwarts	Hi...	2014-05-31 23:26:20	994209432270598145	2018-05-09 13:36:14	52	Someone tell me why a white girl misrepresenting Chinese culture got verified and famous but a fellow brown sis who https://t.co/QpfXZtkYgn	114830310	
994451954406326272	2018-05-10 05:39:56	0	RT @maryamhaidar_: Someone tell me why a white girl misrepresenting Chinese culture got verified and famous but a fellow brown sis who reps	3676132697	Aakriti	aakritiraniii	82	0	533	91	1272			2015-09-16 15:35:29	994209432270598145	2018-05-09 13:36:14	51	Someone tell me why a white girl misrepresenting Chinese culture got verified and famous but a fellow brown sis who https://t.co/QpfXZtkYgn	114830310	
994075604155797506	2018-05-09 04:44:27	0	RT @jordylancaster: If a teenage girl cant wear a prom dress thats from the Chinese culture then non-christian celebrities sure as hell c	2239227971	tay rut 	taylor_rutley	1018	8	10960	976	24030		Psalm 23:4 | @Right_Outlook VP and Contributor | @TPUSA	2013-12-23 04:25:20	993717524436078593	2018-05-08 05:01:34	65	If a teenage girl cant wear a prom dress thats from the Chinese culture then non-christian celebrities sure as he https://t.co/yArBnTJY6J	1488170760	
994036886246187009	2018-05-09 02:10:36	0	RT @jordylancaster: If a teenage girl cant wear a prom dress thats from the Chinese culture then non-christian celebrities sure as hell c	1434351066	Ben Bullinger	benbull248	341	2	5034	772	9023		As conservative as they come. #ProLife Generation. South Dakota State University. Contributor at Lone Conservative. Views do not reflect those of my employer.	2013-05-17 00:56:56	993717524436078593	2018-05-08 05:01:34	63	If a teenage girl cant wear a prom dress thats from the Chinese culture then non-christian celebrities sure as he https://t.co/yArBnTJY6J	1488170760	
994524486576652288	2018-05-10 10:28:09	0	[Trivia] Like the rest of her team, Tenten's character seems to draw inspiration from Chinese culture.	1313150640	 1010	Tenten_NIRP	93	2	88895	23	27		{ [V] #RP @NarutoIndo_RP }  9March #TeamGuy #NIRPFamily	2013-03-29 09:14:57						
994342177131126784	2018-05-09 22:23:43	0	RT @mxie52: 2015s theme was china: through the looking glass and no one was mad bc it highlighted the impact of chinese culture on weste	1066635534	Melle	melanie_doren	585	1	1563	503	10291	New Brunswick, NJ	Rutgers || 08550	2013-01-06 20:35:35	994264854734221312	2018-05-09 17:16:28	4	2015s theme was china: through the looking glass and no one was mad bc it highlighted the impact of chinese cult https://t.co/6dDvlegJS0	516927853	
994571077333463040	2018-05-10 13:33:17	0	RT @LearnCHNchannel: DO YOU KNOW WHO CONFUCIUS REALLY WAS? Check THE ANSWER HERE: https://t.co/XNKMwJ2EeE  #chineseculture #confucius	1670671752	Confucius Institute	GoldsmithsCI	534	10	165	185	57	London	Goldsmiths Confucius Institute for Dance and Performance is a platform which promotes Chinese Language, Martial Arts, Chinese Music and Chinese Dance	2013-08-14 14:54:28	994235460904894464	2018-05-09 15:19:40	2	DO YOU KNOW WHO CONFUCIUS REALLY WAS? Check THE ANSWER HERE: https://t.co/XNKMwJ2EeE  #chineseculture https://t.co/tqDlZEPRnK	775922284758347778	
994323554635255809	2018-05-09 21:09:43	0	RT @jordylancaster: If a teenage girl cant wear a prom dress thats from the Chinese culture then non-christian celebrities sure as hell c	275144910	Hil Blaze	overthe_hil	316	3	5888	307	2633		#410 Go 'Dins	2011-03-31 18:24:17	993717524436078593	2018-05-08 05:01:34	74	If a teenage girl cant wear a prom dress thats from the Chinese culture then non-christian celebrities sure as he https://t.co/yArBnTJY6J	1488170760	
994303719503159296	2018-05-09 19:50:54	0	China Week: Events staged around the globe to promote Chinese culture https://t.co/VXhBzFbryX	111568151	 (  )	gongon23	1552	8	101409	2296	84302			2010-02-05 11:30:39						
994291505828384768	2018-05-09 19:02:22	0	RT @daumkeziah: To everyone causing so much negativity: I mean no disrespect to the Chinese culture. Im simply showing my appreciation to	2258034349	Matt Watson	Wingsman_16	39	0	797	337	1838		Took the day off and still missed the ice cream truck.   /Detroit sports fan, band guy, steak & chili for the win! Also Greg Gutfeld is awesome 	2013-12-22 18:50:23	990255923598786560	2018-04-28 15:46:24	9978	To everyone causing so much negativity: I mean no disrespect to the Chinese culture. Im simply showing my apprecia https://t.co/ByvuZ2b9VN	2842576303	
994328184899293185	2018-05-09 21:28:07	0	[Trivia] Like the rest of her team, Tenten's character seems to draw inspiration from Chinese culture.	1313150640	 1010	Tenten_NIRP	93	2	88869	23	27		{ [V] #RP @NarutoIndo_RP }  9March #TeamGuy #NIRPFamily	2013-03-29 09:14:57						
993532030553124867	2018-05-07 16:44:29	0	@liasofficial @h3h3productions maybe shes sharing the chinese culture by wearing the dress to prom? everyones defin https://t.co/f4y92dQ7Fp	582124060	Marcos	Marcosm802Marta	169	0	303	158	2736		in love with God, music, and kimberley | break the cycle | BLVD Student Ministries |	2012-05-16 20:04:20						
993545112646012930	2018-05-07 17:36:28	0	RT @beylovesnicki: I would not be mad if she involved some video game and Chinese culture in her look tonight while sticking to the theme.	410846233		heforkeeps_	2082	22	93017	952	49366	Fairview Heights, IL	21. be yourself | Onika follows 	2011-11-12 17:07:09	993518993863577600	2018-05-07 15:52:41	3	I would not be mad if she involved some video game and Chinese culture in her look tonight while sticking to the theme. Cmon promo!	3068742603	
993534979077357568	2018-05-07 16:56:12	0	Im all for the beauty of Chinese culture but if I (a Chinese person) wore this to any event Id be getting weird l https://t.co/aFXcGCqs7B	606962693	Liana	lialianana	403	3	10545	479	15492		not a baddie just bad	2012-06-13 06:57:11						
993980581976436736	2018-05-08 22:26:52	0	RT @jordylancaster: If a teenage girl cant wear a prom dress thats from the Chinese culture then non-christian celebrities sure as hell c	167978962	kayla ehrecke	kayla_ehrecke	1563	19	59293	940	131920	Iowa City, IA	making america great again since 1995  i basically tweet The Office quotes all day  proverbs 31:25  	2010-07-18 02:03:15	993717524436078593	2018-05-08 05:01:34	50	If a teenage girl cant wear a prom dress thats from the Chinese culture then non-christian celebrities sure as he https://t.co/yArBnTJY6J	1488170760	
994379531736829953	2018-05-10 00:52:09	0	RT @jordylancaster: If a teenage girl cant wear a prom dress thats from the Chinese culture then non-christian celebrities sure as hell c	2826210127	Lan	alannanicoleeee	594	0	7154	469	10189	08723	mia san mia	2014-09-22 11:16:50	993717524436078593	2018-05-08 05:01:34	76	If a teenage girl cant wear a prom dress thats from the Chinese culture then non-christian celebrities sure as he https://t.co/yArBnTJY6J	1488170760	
993759084947148800	2018-05-08 07:46:43	0	RT @jordylancaster: If a teenage girl cant wear a prom dress thats from the Chinese culture then non-christian celebrities sure as hell c	447156990	Sl	PoutingBeauty	607	4	2860	74	15871			2011-12-26 15:30:53	993717524436078593	2018-05-08 05:01:34	12	If a teenage girl cant wear a prom dress thats from the Chinese culture then non-christian celebrities sure as he https://t.co/yArBnTJY6J	1488170760	
994379326056353792	2018-05-10 00:51:20	0	RT @maryamhaidar_: Someone tell me why a white girl misrepresenting Chinese culture got verified and famous but a fellow brown sis who reps	777399453795819520	Husna	husna_haz	85	2	10750	175	1332	nz 		2016-09-18 06:50:47	994209432270598145	2018-05-09 13:36:14	44	Someone tell me why a white girl misrepresenting Chinese culture got verified and famous but a fellow brown sis who https://t.co/QpfXZtkYgn	114830310	
993782011209945088	2018-05-08 09:17:49	0	RT @Best_of_Tara: The magic of numbers in the Chinese culture https://t.co/dYO9IyVOZ0 #China #Travel https://t.co/vVL6kpg3N8	20070807	GVS London	gvslondon	4222	93	8897	5001	1668	London : New York : Dubai	International Creative Director   Travel : Fashion : Art : Vivere senza scuse. Amare senza rimpianti. Business enquiries: gvslondon@icloud.com	2009-02-04 17:19:14	993781389035229184	2018-05-08 09:15:21	1	The magic of numbers in the Chinese culture https://t.co/dYO9IyVOZ0 #China #Travel https://t.co/vVL6kpg3N8	24875063	
994107355229978624	2018-05-09 06:50:37	0	RT @jordylancaster: If a teenage girl cant wear a prom dress thats from the Chinese culture then non-christian celebrities sure as hell c	1403986609	Brooke Barnidge	brookebarnidge	1113	6	10688	368	16358	Forever LSU	California but not a liberal	2013-05-05 03:19:20	993717524436078593	2018-05-08 05:01:34	66	If a teenage girl cant wear a prom dress thats from the Chinese culture then non-christian celebrities sure as he https://t.co/yArBnTJY6J	1488170760	
993935598346846209	2018-05-08 19:28:07	0	[Trivia] Like the rest of her team, Tenten's character seems to draw inspiration from Chinese culture.	1313150640	 1010	Tenten_NIRP	93	2	88817	23	27		{ [V] #RP @NarutoIndo_RP }  9March #TeamGuy #NIRPFamily	2013-03-29 09:14:57						
994023758645071874	2018-05-09 01:18:26	0	RT @daumkeziah: To everyone causing so much negativity: I mean no disrespect to the Chinese culture. Im simply showing my appreciation to	4851959741	Kate Bonde	BondeKate	114	1	14037	66	18428	Laguna Niguel, CA	If I only had one helmet, I'd give it to you.	2016-01-27 02:13:56	990255923598786560	2018-04-28 15:46:24	9987	To everyone causing so much negativity: I mean no disrespect to the Chinese culture. Im simply showing my apprecia https://t.co/ByvuZ2b9VN	2842576303	
994154728576700416	2018-05-09 09:58:52	0	@RyanProng @UrsulaV There is Chinese CULTURE, There is not Catholic culture just the religion itself https://t.co/KmIgBJlEl3	750480535	Arizah	blind_illusions	128	1	2297	371	5103		Slay every day and shade any bitch in the way 	2012-08-11 02:24:21						
993861228408668160	2018-05-08 14:32:36	0	RT @lialianana: Im all for the beauty of Chinese culture but if I (a Chinese person) wore this to any event Id be getting weird looks and	1920854828	hq	_HANNAHQ	4901	2	8203	621	10962	West Hollywood, CA	disco head	2013-09-30 18:04:27	993534979077357568	2018-05-07 16:56:12	4	Im all for the beauty of Chinese culture but if I (a Chinese person) wore this to any event Id be getting weird l https://t.co/aFXcGCqs7B	606962693	
994314364919443456	2018-05-09 20:33:12	0	RT @jordylancaster: If a teenage girl cant wear a prom dress thats from the Chinese culture then non-christian celebrities sure as hell c	2496580344	Jason Kurmaskie	jkurmask	129	0	496	137	1708	Oxford, MS	I peaked in high school	2014-05-15 15:35:43	993717524436078593	2018-05-08 05:01:34	73	If a teenage girl cant wear a prom dress thats from the Chinese culture then non-christian celebrities sure as he https://t.co/yArBnTJY6J	1488170760	
994300284745732097	2018-05-09 19:37:15	0	RT @daumkeziah: To everyone causing so much negativity: I mean no disrespect to the Chinese culture. Im simply showing my appreciation to	3722314935	_cheezits_	a_cheezits	23	0	204	117	649		Day 43367742468 we still don't know why Kim was crying	2015-09-20 23:19:21	990255923598786560	2018-04-28 15:46:24	9978	To everyone causing so much negativity: I mean no disrespect to the Chinese culture. Im simply showing my apprecia https://t.co/ByvuZ2b9VN	2842576303	
994532246219558912	2018-05-10 10:58:59	0	RT @daumkeziah: To everyone causing so much negativity: I mean no disrespect to the Chinese culture. Im simply showing my appreciation to	794613756307394560	Chelsea	gingerschelsea	15	0	209	17	802	Amsterdam, Nederland	Follow me hoes	2016-11-04 18:54:17	990255923598786560	2018-04-28 15:46:24	9977	To everyone causing so much negativity: I mean no disrespect to the Chinese culture. Im simply showing my apprecia https://t.co/ByvuZ2b9VN	2842576303	
994241882187280384	2018-05-09 15:45:11	0	RT @maryamhaidar_: Someone tell me why a white girl misrepresenting Chinese culture got verified and famous but a fellow brown sis who reps	112961565	Milap	m3jstile	1027	118	176559	716	4686	Central Jersey	I'm a laidback kind of guy with an unusual love for pizza, marketing, strategy, social media, & making people smile. A major Harry Potter and Star Wars fan.	2010-02-10 07:33:10	994209432270598145	2018-05-09 13:36:14	11	Someone tell me why a white girl misrepresenting Chinese culture got verified and famous but a fellow brown sis who https://t.co/QpfXZtkYgn	114830310	
994216138060906496	2018-05-09 14:02:53	0	RT @Regan_Carter: Just as long as theyre not wearing gowns reflective of the Chinese culture, right? https://t.co/dzmOTEpoxP	441399923	Deplorable Basket	WalterHeftyJr	219	0	2789	188	46	Pacific Northwest	Malo periculosam, libertatem quam quietam servitutem.	2011-12-20 02:02:59	994188941380243456	2018-05-09 12:14:49	1	Just as long as theyre not wearing gowns reflective of the Chinese culture, right? https://t.co/dzmOTEpoxP	276318155	
994215588334653440	2018-05-09 14:00:42	0	RT @maryamhaidar_: Someone tell me why a white girl misrepresenting Chinese culture got verified and famous but a fellow brown sis who reps	859828339787354113	Z	zainabxaziz	30	0	963	84	711		17.	2017-05-03 17:53:45	994209432270598145	2018-05-09 13:36:14	3	Someone tell me why a white girl misrepresenting Chinese culture got verified and famous but a fellow brown sis who https://t.co/QpfXZtkYgn	114830310	
994681110612197377	2018-05-10 20:50:31	0	RT @BretWeinstein: Chinese culture regards appropriation of Chinese culture as appropriate. Prohibitions on appropriation render the approp	902894755134095362	Phil Rankin	PhilRankin8	11	0	64	154	208	Vancouver, British Columbia		2017-08-30 14:04:19	991770373275336705	2018-05-02 20:04:17	449	Chinese culture regards appropriation of Chinese culture as appropriate. Prohibitions on appropriation render the a https://t.co/smuj3dH3Zd	78683448	
994710176048480256	2018-05-10 22:46:01	0	RT @mxie52: 2015s theme was china: through the looking glass and no one was mad bc it highlighted the impact of chinese culture on weste	3325035430	G A B R I E L L E	_GabbyAC_	103	1	582	64	4313	OH  MA	 // Welcome to my collection of retweets	2015-06-14 15:18:08	994264854734221312	2018-05-09 17:16:28	6	2015s theme was china: through the looking glass and no one was mad bc it highlighted the impact of chinese cult https://t.co/6dDvlegJS0	516927853	
996003242973724673	2018-05-14 12:24:12	0	Anybody who doesnt understand the concept of Face in Asian culture and especially Chinese culture shouldnt comm https://t.co/RxRzsZMdxg	931028140817653760	Rod Rosenstein is a Criminal	magathemaga1	2084	33	20974	3809	16138		It is one thing to show a man that he is in an error, and another to put him in possession of the truth. John Locke ... A Muckraker of sorts	2017-11-16 05:16:21						
994856918962376704	2018-05-11 08:29:07	0	@jamiecmcgowan I am talking about how the West consumes Chinese culture, not about China the nation state: food and https://t.co/b7LYOTMDvw	12560112	Hannah Johnstone	hannahjherself	537	19	16727	399	16349	Scotland	trans nerd | she/her | radical, green, red | fond of cats, computers, gaming, music, politics and wandering about | I'm not smiling I'm bearing my teeth	2008-01-22 20:20:57						
994875042453446656	2018-05-11 09:41:08	0	RT @maryamhaidar_: Someone tell me why a white girl misrepresenting Chinese culture got verified and famous but a fellow brown sis who reps	27472403	Nicky, Attorney @ Bird Law	jaydestarlight	893	161	219233	1389	49925	Santa Monica, CA	you knock me out/i fall apart/and I thought I was so smart....self published poet obsessed with fandom	2009-03-29 18:15:41	994209432270598145	2018-05-09 13:36:14	72	Someone tell me why a white girl misrepresenting Chinese culture got verified and famous but a fellow brown sis who https://t.co/QpfXZtkYgn	114830310	
995867188429901824	2018-05-14 03:23:34	0	@jasmine082294 The shakuhachi actually came from China. Tbh, Japan has a lot of stuff that was lost from Chinese culture after Tang dynasty.	249052113	the 50% person	the50person	175	1	110582	464	1994	somewhere	NCPS | VIP | VJC | 12v12 | tumblr | dramas | films | wuxia | sarcasm | languages | linguistics | taking planes | SaD | Psycho Drama @_tMF	2011-02-08 07:47:23						
994906348738490370	2018-05-11 11:45:32	0	@KulturVulture Tattoos are banned and the rainbow in Chinese culture is a portent of disaster, really if they wante https://t.co/zY5irX0pDU	891132010323947520		delique00	105	1	634	576	21579		NGT48BiSHAKB48	2017-07-29 03:03:22						
994904000003756032	2018-05-11 11:36:12	0	RT @presidentMT: It was a pleasure to join children from so many schools to celebrate Chinese culture at the Kite Flying Festival, facilita	851211143238602754	France Afrique	fillonafrique	4210	27	169728	3317	164347	France :	Rseau ddi  Franois Fillon, homme dEtat franais lucide,s'est distingu par le courage face  l'adversit, projet rforme France et lutte contre terrorisme	2017-04-09 23:12:06	994887911366676482	2018-05-11 10:32:16	2	It was a pleasure to join children from so many schools to celebrate Chinese culture at the Kite Flying Festival, f https://t.co/kSqAvkx2Hl	2467568810	
995430758612439041	2018-05-12 22:29:21	0	@amyythevegan i mean the entire thing was a racist mockery of chinese culture but???? ok	2491887980	ruby	rubytuesdqy	233	4	1181	383	17953	UK	don't trust the government | 18	2014-05-12 19:46:05						
995746845417713664	2018-05-13 19:25:22	0	RT @daumkeziah: To everyone causing so much negativity: I mean no disrespect to the Chinese culture. Im simply showing my appreciation to	752322392060469248	Crazy D's CDS	KOSOG0NG	4	0	1049	15	583		2K postcount used to be OT Member. Don't post that often. Go away.	2016-07-11 02:03:30	990255923598786560	2018-04-28 15:46:24	9962	To everyone causing so much negativity: I mean no disrespect to the Chinese culture. Im simply showing my apprecia https://t.co/ByvuZ2b9VN	2842576303	
995029577473851396	2018-05-11 19:55:12	0	@MercyfulTits Depends on your upbringing of your parents? Did they teach the child chinese culture/foods/traditions https://t.co/J76lAtGPVP	2345956093	onion	LolicOnion	8416	167	228948	447	235598	https://www.kyuppin.com	Not a boy. Not a girl. An onion!  Indie Dev  I made Lily's Day Off  https://t.co/2vPatfxRO3  Header by @lileaves -Avi by @soyacomu  Buds @6nuih & @Puddypii	2014-02-16 00:40:48						
995058203682525184	2018-05-11 21:48:57	0	RT @daumkeziah: To everyone causing so much negativity: I mean no disrespect to the Chinese culture. Im simply showing my appreciation to	2782202347		therealliberal1	248	0	28219	648	2201		 |  |                                            |  |	2014-08-31 11:58:39	990255923598786560	2018-04-28 15:46:24	9966	To everyone causing so much negativity: I mean no disrespect to the Chinese culture. Im simply showing my apprecia https://t.co/ByvuZ2b9VN	2842576303	
995662153687289857	2018-05-13 13:48:50	0	in chinese culture you have to give a 99 stem bouquet if you mean forever https://t.co/nb7yhr9zMY	4118801653	J et h r o	JethrKoo	105	0	2537	119	1077	UP Law Library (1st Floor)	Parody account.	2015-11-04 01:22:31						
995663550269001735	2018-05-13 13:54:23	0	RT @veIaris: celebrating diversity?? sis culturally appropriated Chinese culture AND her country is literally committing genocide on the	884732647209132034	zoya	galaxysmorley	61	1	569	91	1411		A piece of her soul.	2017-07-11 11:14:35	995446251763056640	2018-05-12 23:30:55	12	celebrating diversity?? sis culturally appropriated Chinese culture AND her country is literally committing genoc https://t.co/IvQCQvucea	845527926200287234	
995060015470989313	2018-05-11 21:56:09	0	Similar beliefs are held in the Chinese culture. Its been interesting try to respect the traditions of Eastern med https://t.co/XRAGlhP0k9	888040751891972096	Sonya Tang Girdwood	STangGirdwood	125	1	480	116	705	Fort Thomas, KY	Peds HM Fellow, budding clinical pharmacologist. Wife. Christian. Advocate for a better foster care system. Singer. Lyric Writer. Triathlete. Loud laugher.	2017-07-20 14:19:49						
995560086167748608	2018-05-13 07:03:15	0	RT @ally_e12: @Yayniv3 @Omar_Gaza I personally thought the song was shit, I also thought that culturally appropriating Chinese culture and	708598225	   	ElidhM	692	108	128696	709	15849		look at the history of the conflicts caused by the west from the crusades to the present day . VITTORIO ARRIGONI 4TH FEB 1975 - 15TH APR 2011	2012-07-21 07:57:37	995449551543787520	2018-05-12 23:44:02	4	@Yayniv3 @Omar_Gaza I personally thought the song was shit, I also thought that culturally appropriating Chinese cu https://t.co/ByABXkxfQh	768469537444560896	
995567832363659264	2018-05-13 07:34:02	0	RT @ally_e12: @Yayniv3 @Omar_Gaza I personally thought the song was shit, I also thought that culturally appropriating Chinese culture and	916725437962817537	tamer	tamerrrrr_	313	0	5735	143	5660	Nederland	bella arino is mine	2017-10-07 18:02:31	995449551543787520	2018-05-12 23:44:02	5	@Yayniv3 @Omar_Gaza I personally thought the song was shit, I also thought that culturally appropriating Chinese cu https://t.co/ByABXkxfQh	768469537444560896	
995435447936602117	2018-05-12 22:47:59	0	How did an Israeli woman appropriating and mocking Chinese culture has won the #eurovision? That is beyond problematic.	4598939601	alessandra 	leoijan	790	4	8756	257	2604	@cassiopehias 	Talking nonsense is the sole privilege mankind possesses over the other organisms	2015-12-25 10:24:56						
995364924770545664	2018-05-12 18:07:45	0	RT @daumkeziah: To everyone causing so much negativity: I mean no disrespect to the Chinese culture. Im simply showing my appreciation to	910040329	Blac Chynas New Man	YEEZY77_	15666	104	74373	11443	14125	Sydney, Australia	God 1st/Kanye West=Legend,#HeatNation/Eagles/Yankees/Chelsea/CF-NDame:CB-Duke/ #LIJ / PS4- Knockout_SL/Becky Lynch is the best/I also Love anime	2012-10-28 10:44:56	990255923598786560	2018-04-28 15:46:24	9963	To everyone causing so much negativity: I mean no disrespect to the Chinese culture. Im simply showing my apprecia https://t.co/ByvuZ2b9VN	2842576303	
995988123158040576	2018-05-14 11:24:07	0	Die &gt;  https://t.co/gyNQeKnGLm   liebe City/town Adult finder in santa rosa Chinese culture datingArkansas Family guyporn meg shags peter	985820609899827200	 	stepaorekhov123	0	0	99	0	0			2018-04-16 10:02:03						
994754652901138432	2018-05-11 01:42:45	0	RT @maryamhaidar_: Someone tell me why a white girl misrepresenting Chinese culture got verified and famous but a fellow brown sis who reps	865543622824939520	Akuunu_Okan	mekhi_vet	134	3	4988	330	14700	Bronx, NY	I am happy daily	2017-05-19 12:24:15	994209432270598145	2018-05-09 13:36:14	69	Someone tell me why a white girl misrepresenting Chinese culture got verified and famous but a fellow brown sis who https://t.co/QpfXZtkYgn	114830310	
