id	created_at	retweet_count	text	user_id	user_name	user_screen_name	user_followers_count	user_listed_count	user_statuses_count	user_friends_count	user_favourites_count	user_location	user_desc	user_created_at	retweeted_status_id	retweeted_status_created_at	retweeted_status_retweet_count	retweeted_status_text	retweeted_status_user_id
944886467720986624	2017-12-24 11:04:23	0	RT @Vanessa_Zhang18: Brainwash from tender age,  boycott western festivals, start from me and now, promote Chinese culture, celebrate Chin	1523803032	()	jenping2000	1303	8	6829	480	32592		  20174	2013-06-17 03:30:53	944874163034054657	2017-12-24 10:15:30	14	Brainwash from tender age,  boycott western festivals, start from me and now, promote Chinese culture, celebrate C https://t.co/JObtkYf8r1	864918572962918400	
944910446452027392	2017-12-24 12:39:40	0	RT @Vanessa_Zhang18: Brainwash from tender age,  boycott western festivals, start from me and now, promote Chinese culture, celebrate Chin	857908292122812416	 	Ming43019551	567	2	10984	474	9948	  	       	2017-04-28 10:44:10	944874163034054657	2017-12-24 10:15:30	35	Brainwash from tender age,  boycott western festivals, start from me and now, promote Chinese culture, celebrate C https://t.co/JObtkYf8r1	864918572962918400	
946485436888776710	2017-12-28 20:58:07	0	[Trivia] Like the rest of her team, Tenten's character seems to draw inspiration from Chinese culture.	1313150640	 1010	Tenten_NIRP	90	2	82553	23	27		{ [V] #RP @NarutoIndo_RP }  9March #TeamGuy #NIRPFamily	2013-03-29 09:14:57						
945236988688441344	2017-12-25 10:17:14	0	One for the #ifyouaretheone #wanggang that I found on FB.  Thanks to this show, my knowledge of Chinese culture &amp; g https://t.co/j8DNpJP2vs	10898322	Eric Brook	erkpod	1405	132	139611	655	170	Sydney, Australia	Hockey fan, player, promoter & writer. Hockey & cricket commentator. Train Captain. YouTube gamer. Related:  @hbrcityhockey @grassroots_au @simulatederk	2007-12-06 09:11:33						
946441073706110981	2017-12-28 18:01:50	0	RT @sportslogosnet: Golden State #Warriors new City uniform a tribute to the Chinese culture throughout the Bay Area and San Francisco's	20927595	Christian Baumeier	Wally44	1803	318	232093	549	121155	Wartenberg, Berlin, Germany	Wally - All you can Tweet / #Hauptstadttwitterer, linker #Sozi, #Rantner #NHL #Hockeynerd #Caps #ebb Hockey Writer fr @EisbaerenNerds	2009-02-15 18:45:08	946440690409488384	2017-12-28 18:00:19	1	Golden State #Warriors new City uniform a tribute to the Chinese culture throughout the Bay Area and San Francisc https://t.co/luaZolVR6n	135947004	
946669575738986497	2017-12-29 09:09:49	0	RT @nightsiren: But that is not good news for the US president, as Chinese culture predicts a year of bad fortune for anyone that https:	259917510	Lifelong Learner	petebestuk	1838	131	80945	2099	39704	Devon. EX15 3BS	Onwards and Upwards	2011-03-02 21:23:52	946668712228159488	2017-12-29 09:06:23	1	But that is not good news for the US president, as Chinese culture predicts a year of bad fortune for anyone that https://t.co/2KZDBjTrwR	309144507	
946465379773239297	2017-12-28 19:38:25	0	@realDonaldTrump Youre a fn moron for fn with China in a tweet.   Chinese culture is all about respect and honor. https://t.co/fgECvxikib	3436136057	William	KillBill4Real	26	0	441	59	504	Everywhere!	is what it is	2015-08-23 00:16:56						
946676877875347456	2017-12-29 09:38:50	0	RT @emramsden: At the Lao She tea house in Beijing I saw these lovely models of tea houses as they were in ancient China #chineseculture ht	569793001	Hornakkan  /  	Hornakkan	304	36	8778	204	3898	France		2012-05-03 08:15:12	946470078178037760	2017-12-28 19:57:05	1	At the Lao She tea house in Beijing I saw these lovely models of tea houses as they were in ancient China https://t.co/4XLpfdaXPP	19234485	
946681734539522048	2017-12-29 09:58:08	0	[Trivia] Like the rest of her team, Tenten's character seems to draw inspiration from Chinese culture.	1313150640	 1010	Tenten_NIRP	90	2	82579	23	27		{ [V] #RP @NarutoIndo_RP }  9March #TeamGuy #NIRPFamily	2013-03-29 09:14:57						
946203146870755330	2017-12-28 02:16:24	0	The magic of numbers in the Chinese culture https://t.co/dYO9IyVOZ0 #China #Travel https://t.co/MJpAS7yQc8	24875063	TaraGoldsmith	Best_of_Tara	18172	1029	71192	15706	7438	Planet Earth	#Travel to Learn, to Experience, to Share	2009-03-17 12:40:26						
946085207886782465	2017-12-27 18:27:45	0	RT @ComplexSports: .@DetroitPistons - Chrome details for the automotive-inspired jerseys.  @warriors - Pays tribute to Chinese culture in t	258477030	Michael	sweetermansosa	578	1	6245	347	6163		 ||	2011-02-27 20:24:55	946066232125673479	2017-12-27 17:12:21	32	.@DetroitPistons - Chrome details for the automotive-inspired jerseys.  @warriors - Pays tribute to Chinese culture https://t.co/K82jplB4Ej	262715431	
946248727651422208	2017-12-28 05:17:31	0	RT @essenviews: IT'S BAD WHEN THE CHINESE DISPLAY NO RESPECT; THAT'S RARE IN CHINESE CULTURE: A Giant Dog Statue With Trumpian Characterist	887178668841222146	Josette Pernu	JosettePernu	462	1	27871	601	36116	Campbell River, British Columbia	my previous Twitter account with 900+ followers was hacked and I had to start again. Retired educator, traveller, reader, love American politics.	2017-07-18 05:14:12	946233047447363584	2017-12-28 04:15:13	12	IT'S BAD WHEN THE CHINESE DISPLAY NO RESPECT; THAT'S RARE IN CHINESE CULTURE: A Giant Dog Statue With Trumpian Char https://t.co/noxbfP8PQ8	2998864022	
946233430626287617	2017-12-28 04:16:44	0	RT @essenviews: IT'S BAD WHEN THE CHINESE DISPLAY NO RESPECT; THAT'S RARE IN CHINESE CULTURE: A Giant Dog Statue With Trumpian Characterist	839251735583449088	Diana Haering	dkcsh1	46	0	2517	34	2705		trump declared me the enemy in his New Years Day speech in 2017, because I didnt vote for him. Also because Im a woman & I have a science degree. Truth!	2017-03-07 23:09:41	946233047447363584	2017-12-28 04:15:13	1	IT'S BAD WHEN THE CHINESE DISPLAY NO RESPECT; THAT'S RARE IN CHINESE CULTURE: A Giant Dog Statue With Trumpian Char https://t.co/noxbfP8PQ8	2998864022	
946251445426446337	2017-12-28 05:28:19	0	RT @essenviews: IT'S BAD WHEN THE CHINESE DISPLAY NO RESPECT; THAT'S RARE IN CHINESE CULTURE: A Giant Dog Statue With Trumpian Characterist	853711965541105664	Ms. Lonnie	Lon_S_J	138	1	4561	246	14832	New York, USA	Lions club, #Resistance  ID channel, animals, music & dancing. Married to the right man now. Angels help me through. @TheBrightonBeat fan	2017-04-16 20:49:28	946233047447363584	2017-12-28 04:15:13	17	IT'S BAD WHEN THE CHINESE DISPLAY NO RESPECT; THAT'S RARE IN CHINESE CULTURE: A Giant Dog Statue With Trumpian Char https://t.co/noxbfP8PQ8	2998864022	
946500817388843008	2017-12-28 21:59:14	0	RT @sportslogosnet: Golden State #Warriors new City uniform a tribute to the Chinese culture throughout the Bay Area and San Francisco's	1005469758	Riley Mohr	BondBoy93	103	1	3273	254	10267			2012-12-12 03:35:00	946440690409488384	2017-12-28 18:00:19	8	Golden State #Warriors new City uniform a tribute to the Chinese culture throughout the Bay Area and San Francisc https://t.co/luaZolVR6n	135947004	
945950936333258752	2017-12-27 09:34:12	0	RT @pingroma: Watch out Trump: In Chinese culture, its generally believed to be bad luck if the zodiac animal of the current year is the	562164378	zhongguowenhua	zhongguowenhua1	337	52	32834	81	4632	France	Prof de philo retrait, spcialiste de Zola. Amoureuse de la Chine, autodidacte en chinois, je dfends les droits de l'homme. Passions: littrature, art, cinma	2012-04-24 14:48:29	945933040231968768	2017-12-27 08:23:06	4	Watch out Trump: In Chinese culture, its generally believed to be bad luck if the zodiac animal of the current ye https://t.co/alDr2ICUAa	2758089968	
946000072210132992	2017-12-27 12:49:27	0	RT @kxleeuy: In japanese &amp; chinese culture, there's a belief that a child conceived underneath the Northern Lights will be blessed with goo	4852647809	jbheart14	jbheart141	241	14	90169	244	114482	Hong Kong	Die hard fan of Judyann Santos KimChiu &Sandara Park & Yg artist Bigbang,2ne1 & iKON	2016-01-27 06:50:33	945986366495629312	2017-12-27 11:55:00	7	In japanese &amp; chinese culture, there's a belief that a child conceived underneath the Northern Lights will be bless https://t.co/L4Pu88eLle	2299600656	
945940830065270784	2017-12-27 08:54:03	0	Guests also learned about cookinghealthtraditional Chinese teaikebana and Chinese culture at Experteas#ikebana https://t.co/Et4vpB5fc2	932497587780775942	experteas	experteas1	11	0	28	40	84		Experteas Teahouse. Handmade Pottery & Porcelain.Beijing, China. Etsy shop: ExperteasPurchase inquiry: chaweilife@hotmail.com https://t.co/ZcgQOV8Zdb	2017-11-20 06:35:24						
945986776035876864	2017-12-27 11:56:37	0	RT @kxleeuy: In japanese &amp; chinese culture, there's a belief that a child conceived underneath the Northern Lights will be blessed with goo	78204433	TEAMPANATAG4EVER	lonaseair	2243	27	219575	125	35453		KIMXI lover/working mama	2009-09-29 03:28:48	945986366495629312	2017-12-27 11:55:00	1	In japanese &amp; chinese culture, there's a belief that a child conceived underneath the Northern Lights will be bless https://t.co/L4Pu88eLle	2299600656	
947270618919026689	2017-12-31 00:58:09	0	[Trivia] Like the rest of her team, Tenten's character seems to draw inspiration from Chinese culture.	1313150640	 1010	Tenten_NIRP	90	2	82657	23	27		{ [V] #RP @NarutoIndo_RP }  9March #TeamGuy #NIRPFamily	2013-03-29 09:14:57						
947150808952573952	2017-12-30 17:02:04	0	@shukms i had a white customer come up to me the other day and just say chinese culture. ????	23497995	ericajune 	uureeeka	227	1	17119	175	8475	a cool spot in hell	my name is erica may but u can call me anytime	2009-03-09 20:45:53						
946673186619514880	2017-12-29 09:24:10	0	'FACE' IN THE CHINESE CULTURE https://t.co/ZnxQ53gsmo	34868017	Jodee Lim	nihaohello	41104	765	44681	10606	625	Singapore	Learn #Chinese vocabulary and #mandarin via Twitter! You will learn a new word every day. #languages # #	2009-04-24 06:36:29						
946917718229266434	2017-12-30 01:35:51	0	RT @emramsden: In the face of growing consumerism, China is reconnecting with ancient Daoism  https://t.co/zU4Nz4Vg1a #chineseculture https	889622625621770240	Chinese With Pei	ChinesewithPei	15	0	160	36	115	United States	I am providing useful tools for people the world over to learn Mandarin Chinese.	2017-07-24 23:05:37	946832464193949698	2017-12-29 19:57:05	1	In the face of growing consumerism, China is reconnecting with ancient Daoism  https://t.co/zU4Nz4Vg1a https://t.co/uC0aRpvJCT	19234485	
947578703382532097	2017-12-31 21:22:22	0	RT @MazMHussain: Interesting observation on how Daoism preserved traditional Chinese culture, from The Souls of China: The Return of Relig	707729844637798401	Sharansky Weiler	SharanskyWailer	100	5	7644	530	20657			2016-03-10 00:48:38	947568747476406274	2017-12-31 20:42:49	6	Interesting observation on how Daoism preserved traditional Chinese culture, from The Souls of China: The Return o https://t.co/UMMrwzLmhX	84816752	
