id	created_at	retweet_count	text	user_id	user_name	user_screen_name	user_followers_count	user_listed_count	user_statuses_count	user_friends_count	user_favourites_count	user_location	user_desc	user_created_at	retweeted_status_id	retweeted_status_created_at	retweeted_status_retweet_count	retweeted_status_text	retweeted_status_user_id
964510521352474625	2018-02-16 14:43:22	0	RT @ParisJeTaime: Happy Lunar New Year from Paris!  Did you know that Chinese culture is visible in many areas of the city? For example,	963855955229380615	Ashlee A. Bernet	BernetAshlee	0	0	4	9	1	Carbondale, IL	I'm a hopeful blogger, potential graduate, and lover of all things print media. Add me!	2018-02-14 19:22:22	964507900348641280	2018-02-16 14:32:57	5	Happy Lunar New Year from Paris!  Did you know that Chinese culture is visible in many areas of the city? For exa https://t.co/qm8wYhYRDK	292409371	
964473179396812801	2018-02-16 12:14:59	0	RT @CUPBookshop: Happy #ChineseNewYear.  If you'd like to learn more about Chinese festivals, our Introductions to Chinese Culture series i	881280764	Vanisha Sukdeo	VanishaSukdeo	558	45	3660	786	728		Lawyer, Course Instructor, and Ph.D. Candidate at Osgoode Hall Law School. My research is at the intersection of corporate law, and labour & employment law.	2012-10-15 01:03:01	964412419903692800	2018-02-16 08:13:33	3	Happy #ChineseNewYear.  If you'd like to learn more about Chinese festivals, our Introductions to Chinese Culture s https://t.co/5jGZZ2lUOT	156304811	
964457379474616320	2018-02-16 11:12:12	0	If you are still feeling down about being single on Valentines Day, embrace Chinese culture.  Today, married peopl https://t.co/CeUT9jIFSY	2939030485	Michelle Elman	ScarredNtScared	4334	49	9911	507	9582	London	Body Confidence Coach  Award Winning Body Positive Activist  TedX Speaker  Insta: @ScarredNotScared  Author of Am I Ugly? out in July 2018. Preorder below	2014-12-22 06:17:03						
964776604420460544	2018-02-17 08:20:41	0	RT @Best_of_Tara: The magic of numbers in the Chinese culture https://t.co/dYO9IyVOZ0 #China #Travel https://t.co/dAdMrO7MT7	734992270961876993	Travelhog	Travelhogger	173	25	672	461	1305	England, United Kingdom	Travel Travel Travel_Obsessed TravelSkills Travel_Rewards_ TravelTuesday Food	2016-05-24 06:19:47	964770194165059585	2018-02-17 07:55:13	4	The magic of numbers in the Chinese culture https://t.co/dYO9IyVOZ0 #China #Travel https://t.co/dAdMrO7MT7	24875063	
964764029754494977	2018-02-17 07:30:43	0	RT @JefffSquad: Earlier today, Friday February 16th, JeffSquad Tours attended the 28th annual Chinese Culture &amp; https://t.co/0xfw6euCuC	30141658	Kevin	BlvdKev80	813	47	10414	1631	5844	Kansas City, MO	#DallasCowboys #BoulevardBeer #CountryMusic #KCRoyals #CraftBeer #FOREVERROYAL #HomeBrewer  BURY ME A ROYAL.                  http://PayPal.me/blvdkev80	2009-04-10 02:51:31	964754790860378112	2018-02-17 06:54:01	1	Earlier today, Friday February 16th, JeffSquad Tours attended the 28th annual Chinese Culture &amp; https://t.co/0xfw6euCuC	3255867757	
964544441108267008	2018-02-16 16:58:09	0	RT @lilmonx3: In Chinese culture, it is considered good luck to wear red on the new year! Make sure to wear some red today for good luck~	585878406	aitorchick	vanitasmaster17	243	6	20976	501	24146	Cuenca(Espaa)	os vigilo (  ) e	2012-05-20 16:33:10	964540514543525888	2018-02-16 16:42:33	3	In Chinese culture, it is considered good luck to wear red on the new year! Make sure to wear some red today for good luck~	946071183375548417	
964598626860322822	2018-02-16 20:33:28	0	RT @AlbertyClara: Happy Lunar New Year. 2018 is the year of the dog in Chinese culture  , what animal are you ? #gunghayfatchoy#pavetheway	831898114676097025	Pearson Elementary	SLCSpearson	376	4	1086	198	2660			2017-02-15 16:09:01	964598209317351426	2018-02-16 20:31:49	1	Happy Lunar New Year. 2018 is the year of the dog in Chinese culture  , what animal are you ? #gunghayfatchoy#pavet https://t.co/zLunnntlKt	904684339920850945	
964592439473442816	2018-02-16 20:08:53	0	My 3rd grade teacher in Beijing who was a suck-up, white-worshiping, Chinese-culture-hating materialistic troll who https://t.co/kTciwLL9fK	308044567	Tangy Cat	catofalltrades	176	14	12935	396	37621		I'm a yellow tang. | Political correctness | is not my forte. || Engineer. Artist. Polyglot. Immigrant. She/her.	2011-05-30 18:50:43						
964588237804261376	2018-02-16 19:52:11	0	RT @teamhillside: Learning about Lunar New Year and celebrating the Chinese culture! https://t.co/nCOrtJCTd4	857003965418004480	Dr.JenniferMorrison	Dr_J_Morrison	128	1	519	87	1254			2017-04-25 22:50:42	964567032640483328	2018-02-16 18:27:56	1	Learning about Lunar New Year and celebrating the Chinese culture! https://t.co/nCOrtJCTd4	761656219413123072	
964944166395531265	2018-02-17 19:26:31	0	In the chinese culture the red color is a symbol of good luck. The positive things are red https://t.co/0Uz2ZOhKfv	2491747969	Aina Ramis	Aina_Ramis	36	2	261	215	129	Barcelona	(Foto)Periodista. Con Mallorca en el corazn. Sgueme en http://instagram.com/ainaramis.journalism	2014-05-12 17:23:38						
964410134943342592	2018-02-16 08:04:28	0	RT @caratmilk: [17 WEIBO UPDATE] [TRANS] [17'S] 2018 Eight Eight is make a fortune // In Chinese culture, the number 8 is a lucky number an	911343342142726145	mila | thanks 	B00N0NIE	643	3	7788	167	15542	svt		2017-09-22 21:35:59	963994607926198273	2018-02-15 04:33:19	13	[17 WEIBO UPDATE] [TRANS] [17'S] 2018 Eight Eight is make a fortune // In Chinese culture, the number 8 is a lucky https://t.co/qh2jJfsCPn	890994434271133696	
964465906653986817	2018-02-16 11:46:05	0	RT @ScarredNtScared: If you are still feeling down about being single on Valentines Day, embrace Chinese culture.  Today, married people g	460544686	Gabi Rodriguez 	invisiblemuda	244	1	3899	285	6311	Valparaso	Lic. en Arte/Mam perro/Cantante en la ducha/Amante del t/Experta en dulces/Cocinera distrada/Creyente de los unicornios.	2012-01-10 21:40:09	964457379474616320	2018-02-16 11:12:12	2	If you are still feeling down about being single on Valentines Day, embrace Chinese culture.  Today, married peopl https://t.co/CeUT9jIFSY	2939030485	
965559701285974017	2018-02-19 12:12:26	0	RT @xinwenxiaojie: Well, well,well. A person from Beijing who thinks there's only one kind of Chinese culture. Bye bye. https://t.co/Hhupmx	110911008	Philip Yeung	philipymf	93	10	3259	837	2893	Hong Kong	Fond of food, travel, languages and politics. Tweets in English and Chinese mostly, et quelquefois en franais.	2010-02-03 05:07:57	965101653492994048	2018-02-18 05:52:19	17	Well, well,well. A person from Beijing who thinks there's only one kind of Chinese culture. Bye bye. https://t.co/HhupmxLF3o	283035531	
965612482692898818	2018-02-19 15:42:10	0	RT @GreenEarthArt: Our rescue #shihtzu Annie doesn't have a definite birth date, so we celebrate her breed and Chinese Culture each year at	109897852	Carole Hiscock	wildseawitch	2508	278	45170	865	13809	Staffordshire, England	Handcrafted Pagan & Retro Giftwares. Witches, Rockabilly, History, Art, Animals, FAMILY, The Magickal Sea & Red Lipstick. #QueenOf #SmartSocial Winner	2010-01-30 16:41:35	964648642459197440	2018-02-16 23:52:13	1	Our rescue #shihtzu Annie doesn't have a definite birth date, so we celebrate her breed and Chinese Culture each ye https://t.co/pzL70Dht7M	2263342495	
965043784865099776	2018-02-18 02:02:22	0	RT @ChinaDailyUSA: More than #300 visitors crowded the #Chicago Cultural Center and had a bit taste of traditional #Chinese culture as a #c	823741612769431552	Cold Brewing Tea	FrankJian888	20	0	86	190	74	Guizhou	We are a special manufacturer for tea plantations, processing and exporting. We have own over 500 hectare tea garden and it is EU Standard tea garden in China.	2017-01-24 03:57:59	964982800238727171	2018-02-17 22:00:02	15	More than #300 visitors crowded the #Chicago Cultural Center and had a bit taste of traditional #Chinese culture as https://t.co/twhPgZRLJN	87775422	
965168507049725953	2018-02-18 10:17:58	0	RT @xinwenxiaojie: Well, well,well. A person from Beijing who thinks there's only one kind of Chinese culture. Bye bye. https://t.co/Hhupmx	320747654	Odilon	odilonhk	232	11	3276	424	508			2011-06-20 13:18:20	965101653492994048	2018-02-18 05:52:19	9	Well, well,well. A person from Beijing who thinks there's only one kind of Chinese culture. Bye bye. https://t.co/HhupmxLF3o	283035531	
965672460975620096	2018-02-19 19:40:30	0	RT @bunsenbernerbmd: Happy Year of the Dog!  My dad and brother both do Praying Mantis Kungfu so they like to celebrate Chinese culture!  I	822609329450811392	bella barr	bellabarr4	1112	5	18051	1159	59204	USA	I am Bella, a happy border collie with 2 silly sisters: Minnie Moodle, &  Willow aka Wee-dough	2017-01-21 00:58:42	965671704218386432	2018-02-19 19:37:30	1	Happy Year of the Dog!  My dad and brother both do Praying Mantis Kungfu so they like to celebrate Chinese culture! https://t.co/csfo6oKdCU	917201597247012864	
965205849395400704	2018-02-18 12:46:21	0	RT @Zenon8703: @AV_Irma Happy Lunar New Year from Paris!  Did you know that Chinese culture is visible in many areas of the city : For ex	1416471355	ClA	Zenon8703	4880	264	124496	5360	146016		Lo malo no son las cosas sino las ideas que nos hacemos de las cosas	2013-05-09 21:05:51	965205806235955200	2018-02-18 12:46:11	1	@AV_Irma Happy Lunar New Year from Paris!  Did you know that Chinese culture is visible in many areas of the city https://t.co/I3U3opVsJL	1416471355	
965103247781490689	2018-02-18 05:58:39	0	RT @TheMEAA: Happy #ValentinesDay! In Chinese culture, mandarin ducks are considered symbols of love, so its only fitting that there are tw	757762683974410241	Selftweet	vitaphil1	31	0	9992	87	0			2016-07-26 02:21:17	963745927017254914	2018-02-14 12:05:09	4	Happy #ValentinesDay! In Chinese culture, mandarin ducks are considered symbols of love, so its only fitting that t https://t.co/omWU9WKyaL	1851103482	
965381413129281536	2018-02-19 00:23:59	0	RT @thebeautyoftea: Chinatown in Milan today. The Chinese culture is becoming more and more popular in Italy. https://t.co/M2PpESmBJB	891236603942715392	niubi	Niubiboy1	82	3	4462	86	3857	Sydney, New South Wales	fisho	2017-07-29 09:58:59	965296925636521984	2018-02-18 18:48:16	1	Chinatown in Milan today. The Chinese culture is becoming more and more popular in Italy. https://t.co/M2PpESmBJB	3372773969	
965385511555796992	2018-02-19 00:40:16	0	Mother, Daughter date to see Sheng Yun, an amazing show. So happy that the Chinese culture still https://t.co/EH4AYOqwOK	283032642	ThiaLove	thia_vue	72	0	2632	53	82		You only live once.  IG: thiavue  snapchat: thiavue	2011-04-16 12:41:59						
965749992534061056	2018-02-20 00:48:35	0	RT @CapellaHotels: Learn more about the biggest festival in Chinese culture.  Here are 50 fun facts about #LunarNewYear via  @factretriever	48047875	Capella Singapore	CapellaSIN	1877	169	11343	227	9566	Sentosa Island, Singapore	As a member of the Capella Hotels family, I am your go-to source for all things Capella Singapore and Singapore.	2009-06-17 17:53:49	965745419748823040	2018-02-20 00:30:25	1	Learn more about the biggest festival in Chinese culture.  Here are 50 fun facts about #LunarNewYear via https://t.co/S29VGpZOO7	72657485	
965747576694743043	2018-02-20 00:38:59	0	RT @jiehyunglo: @chen_yonglin I believe China can and should change. I am a firm supporter of traditional Chinese culture and heritage (not	559924540	Warren	WarrenRothman	1396	6	10166	2152	10723		Author, Kafka In China, Part One, The People's Republic of Corruption - http://tinyurl.com/kafkainchina	2012-04-21 23:09:08	965742393315094528	2018-02-20 00:18:23	1	@chen_yonglin I believe China can and should change. I am a firm supporter of traditional Chinese culture and herit https://t.co/PQlkX1n3my	3543453133	
965702500736266241	2018-02-19 21:39:52	0	RT @RepEdThompson: Happy New Year from the Pearland Chinese Association! I enjoyed a great evening by celebrating the Chinese culture and w	2588167693	The Interim	86thLegislature	8039	440	170795	2728	67307	Austin, Texas	Like most passionate nations, Texas has its own history based on, but not limited by, facts. -John Steinbeck #txlege	2014-06-25 20:19:24	965688580726251520	2018-02-19 20:44:33	1	Happy New Year from the Pearland Chinese Association! I enjoyed a great evening by celebrating the Chinese culture https://t.co/GdztljbYyQ	1096434308	
965329606122221568	2018-02-18 20:58:07	0	[Trivia] Like the rest of her team, Tenten's character seems to draw inspiration from Chinese culture.	1313150640	 1010	Tenten_NIRP	91	2	85049	23	27		{ [V] #RP @NarutoIndo_RP }  9March #TeamGuy #NIRPFamily	2013-03-29 09:14:57						
965327681142362113	2018-02-18 20:50:28	0	RT @HedyFry: Chinatown Spring Celebration today in Vana great event to welcome the Year of the Dog and honour the vibrant Chinese culture	111713801	MP Tweets	canadamptweets	3848	215	53626	4334	0	Ottawa, Ontario	Tweets from all Federal MPs, across all parties. Enjoy this handy resource provided by Jordan St Jacques from @mydigitera	2010-02-05 22:36:43	965327582198747136	2018-02-18 20:50:05	1	Chinatown Spring Celebration today in Vana great event to welcome the Year of the Dog and honour the vibrant Chine https://t.co/gpOuWPh4HW	25127782	
965355417642643456	2018-02-18 22:40:41	0	RT @_YolandaYang_: WhiteaAnnie carries the idea of spreading Chinese culture of fine art vase which like a pretty and fascinating lady and	16157409	Sean Gresh	SeanGresh	352	60	3545	593	195	Somerville, Massachusetts	#Speechwriter #Communications #freelancewriter  Adjunct professor, #Northeastern #BostonCollege #pilot	2008-09-06 15:12:02	964607756228595712	2018-02-16 21:09:45	1	WhiteaAnnie carries the idea of spreading Chinese culture of fine art vase which like a pretty and fascinating lady https://t.co/yEKGHYFbgn	956755197904080900	
965349538310557698	2018-02-18 22:17:19	0	Intricate thread design of the iconic #Manchester bee. Her patience depicts true #Chinese culture. #ChineseNewYear https://t.co/LmFjKzQAfI	270349478	Martin Asiedu-Dartey	NewsyMartin	15263	62	15215	404	1809	Manchester, England	A Chevening Scholar. International Broadcast/Online Journalist & a story teller. Loves God & @ManUtd	2011-03-22 13:12:18						
965377912001236997	2018-02-19 00:10:04	0	RT @MF_Brown: If Rush Hour came out today, there would be so many think pieces about how offensive the film is to Chinese culture and wom	836357555202981888	Whitley Gilbert	OkThotianna	416	2	24286	184	60751	GA 	virgo  wine mom	2017-02-27 23:29:14	965376050577358848	2018-02-19 00:02:40	7	If Rush Hour came out today, there would be so many think pieces about how offensive the film is to Chinese cultu https://t.co/wXT0HBzYWt	33829337	
965391828282478592	2018-02-19 01:05:22	0	RT @MF_Brown: If Rush Hour came out today, there would be so many think pieces about how offensive the film is to Chinese culture and wom	132007164	Killmonger Stan Account	YawnYeezus	748	25	172507	297	19523	TX	Cowboys have distracted me from my creative process. I'm reclaiming my time.	2010-04-12 01:15:54	965376050577358848	2018-02-19 00:02:40	12	If Rush Hour came out today, there would be so many think pieces about how offensive the film is to Chinese cultu https://t.co/wXT0HBzYWt	33829337	
964987103410114561	2018-02-17 22:17:08	0	RT @ChinaDailyUSA: More than #300 visitors crowded the #Chicago Cultural Center and had a bit taste of traditional #Chinese culture as a #c	732547551963033600	Jie Liang	JieLiangSYOTW	115	0	1095	108	2439	Aurora, IL	Husband, father, son, advocate of best engineering practices, tai chi practitioner, kayaker, cappuccino & music lover	2016-05-17 12:25:21	964982800238727171	2018-02-17 22:00:02	5	More than #300 visitors crowded the #Chicago Cultural Center and had a bit taste of traditional #Chinese culture as https://t.co/twhPgZRLJN	87775422	
965436986826870785	2018-02-19 04:04:49	0	Experts saythe popular belief in Chinese culture is that people are often less lucky when they are in the same Zod https://t.co/KuT7HwmHnp	917331339950428160	Business Insider MY	BizInsiderMY	82	3	12385	15	0	Malaysia	Business Insider Malaysia was created for a new generation of aspiring professionals and business leaders offering deep coverage of tech business and strategy	2017-10-09 10:10:09						
965017637817208832	2018-02-18 00:18:28	0	RT @chrisapplegate: Not saying there is a Beijing conspiracy to flood the UK media. But these pieces implying Chinese culture is a monocult	1381521512	Samuel Carver	TheAccidentMan9	819	67	59403	1661	2516	=[rothwell Gornt]=	The Accident Man. Lover of #thrillernovels, #guns #ChelseaFC #geopolitics and #PersonOfInterest. still prefer #Android...for now	2013-04-26 09:47:09	964850585441882112	2018-02-17 13:14:40	1	Not saying there is a Beijing conspiracy to flood the UK media. But these pieces implying Chinese culture is a mono https://t.co/36vjOP3R2k	80363	
965123095085268992	2018-02-18 07:17:31	0	... Using music to describe the Chinese culture of People at birth, are naturally kind-hearted () is eas https://t.co/D9kap3NqSa	1659391068	OurHome AUS&NZ	OurHomeAUSNZ	218	3	4137	42	122	Australia & New Zealand	The official Twitter account for  Leehom Wang's Australia and New Zealand fan club - OurHome AUS & NZ. Founded 2004.	2013-08-10 06:19:31						
965122051060060160	2018-02-18 07:13:22	0	RT @xinwenxiaojie: Well, well,well. A person from Beijing who thinks there's only one kind of Chinese culture. Bye bye. https://t.co/Hhupmx	943011589896077317	James Ockenden	BlueSkiesChina	342	1	502	1537	2064	Hong Kong	#Journalist with a passion for #cleantech and #publichealth. 20yrs #energy markets, today focussed on #cleanair and #tobaccocontrol. Tweets personal opinion.	2017-12-19 06:54:18	965101653492994048	2018-02-18 05:52:19	6	Well, well,well. A person from Beijing who thinks there's only one kind of Chinese culture. Bye bye. https://t.co/HhupmxLF3o	283035531	
965511492455096325	2018-02-19 09:00:52	0	RT @edtheatres: Happy #chinesenewyear! Celebrate the Year of the Dog by discovering five millennia of traditional Chinese culture with Shen	745014260087070720	Edinburgh Watch	EdinburghWatch	4668	2760	478131	0	25	Edinburgh, Scotland	I retweet content from around Edinburgh to present a cross-section of life in the Lothians. Created by actual human @ardavey.	2016-06-20 22:03:36	965511317636476928	2018-02-19 09:00:11	1	Happy #chinesenewyear! Celebrate the Year of the Dog by discovering five millennia of traditional Chinese culture w https://t.co/jHiD5kY50A	133670767	
965594174539157505	2018-02-19 14:29:25	0	RT @SugarTheGoldenR: Woofs! #ChineseNewYear celebrationred in Chinese culture is the symbol of happiness, wealth, prosperity, and can ward	2394777421	Loving Hands Animal	LovingHandsAC	1338	28	8587	1590	9563	13775 Hwy 9 N Alpharetta GA 	Full Service AAHA Animal Hospital & Pet Resort  (770)667-9022	2014-03-17 17:04:42	965015543102111744	2018-02-18 00:10:09	9	Woofs! #ChineseNewYear celebrationred in Chinese culture is the symbol of happiness, wealth, prosperity, and can w https://t.co/mLTfieMU7S	20707535	
965770477451931649	2018-02-20 02:09:59	0	RT @bunsenbernerbmd: Happy Year of the Dog!  My dad and brother both do Praying Mantis Kungfu so they like to celebrate Chinese culture!  I	34720029	Toronto Bernese	Reudi	2112	95	27153	956	35642	Toronto	My name is Boomer and I'm a well loved, well fed and occasionally well groomed Bernese Mountain Dog living a good dog's life.	2009-04-23 20:31:10	965671704218386432	2018-02-19 19:37:30	9	Happy Year of the Dog!  My dad and brother both do Praying Mantis Kungfu so they like to celebrate Chinese culture! https://t.co/csfo6oKdCU	917201597247012864	
966075626095632384	2018-02-20 22:22:32	0	RT @RCHSPride: Thanks to the Chinese Culture Club for throwing a party! #rchspride #YearOfTheDog https://t.co/OYJNeqRLDB	2872820673	Jim Meister	RCHS_Athletics	757	6	3028	299	523			2014-11-11 20:36:50	966074044062806017	2018-02-20 22:16:15	1	Thanks to the Chinese Culture Club for throwing a party! #rchspride #YearOfTheDog https://t.co/OYJNeqRLDB	1112147269	
966295368391634948	2018-02-21 12:55:43	0	The magic of numbers in the Chinese culture https://t.co/dYO9IyVOZ0 #China #Travel https://t.co/A8MQf0xK23	24875063	TaraGoldsmith	Best_of_Tara	19572	1040	77479	17934	8203	Planet Earth	#Travel to Learn, to Experience, to Share	2009-03-17 12:40:26						
965921778706022401	2018-02-20 12:11:12	0	RT @evazhengll: One of the best Chinese documentaries ever! Not only for foodies, but for those who love to explore Chinese culture, tradit	2965608929	MELEK ONE      	onemelek1	940	320	116645	348	69125	USA.		2015-01-07 07:02:29	965858551347449857	2018-02-20 07:59:58	5	One of the best Chinese documentaries ever! Not only for foodies, but for those who love to explore Chinese culture https://t.co/ZfDeVMh8u1	4603259056	
965945543892619264	2018-02-20 13:45:38	0	RT @bunsenbernerbmd: Happy Year of the Dog!  My dad and brother both do Praying Mantis Kungfu so they like to celebrate Chinese culture!  I	406638553	Esther Murguia	ermurro	280	92	40662	172	37247	Ciudad de Mxico		2011-11-07 00:12:59	965671704218386432	2018-02-19 19:37:30	11	Happy Year of the Dog!  My dad and brother both do Praying Mantis Kungfu so they like to celebrate Chinese culture! https://t.co/csfo6oKdCU	917201597247012864	
966027797947977730	2018-02-20 19:12:29	0	RT @bunsenbernerbmd: Happy Year of the Dog!  My dad and brother both do Praying Mantis Kungfu so they like to celebrate Chinese culture!  I	885086344657195008	Darlene Anderson	LadyDruofKithik	1211	3	480	1120	9117		Writer, blogger, gamer, bassist, manager and also a traveler, and Animal lover. Thats me	2017-07-12 10:40:03	965671704218386432	2018-02-19 19:37:30	13	Happy Year of the Dog!  My dad and brother both do Praying Mantis Kungfu so they like to celebrate Chinese culture! https://t.co/csfo6oKdCU	917201597247012864	
966173797828116480	2018-02-21 04:52:38	0	RT @Echinanews: #ChinaCulture: Some viewers tuned in to watch the show's new season with the hope of understanding Chinese culture via food	2873312001	Zhenzhong Si, PhD	SiChinaFood	603	30	588	1001	588	Waterloo, Ontario	Postdoctoral fellow specializing in China's #food system. #BCH supporter. I tweet on #China #foodsecurity #sustainablefoodsystem #ruraldevelopment #	2014-11-12 04:27:32	966133053742505984	2018-02-21 02:10:44	3	#ChinaCulture: Some viewers tuned in to watch the show's new season with the hope of understanding Chinese culture https://t.co/V5JxJcgdew	338736117	
965868901664882688	2018-02-20 08:41:05	0	@AyeshaASiddiqi Concerned shes  one of the many white ppl who make their career off of extracting Chinese culture. https://t.co/pnrf98rs0m	802301495781691392	Michelle	michellemuqing	23	0	136	59	1154		Chinese American. Rolling my eyes at white ppl. Reluctant law student.	2016-11-26 00:02:37						
966000752542892033	2018-02-20 17:25:01	0	this kind of twitter users are the ones who will tell u that it is you're appropriating the Chinese culture cause y https://t.co/ptwsbQvxr0	958198509320077312	jos rizal's illegitimate daughter	fagyke	159	2	775	140	5189		an incest shipper	2018-01-30 04:41:41						
965983791599771648	2018-02-20 16:17:37	0	RT @mattwilson_star: Could the importance of 'losing face' in Chinese culture encourage Guochuan Lai to sharpen his knives again? #wba http	965257526639058944	West Brom Star News	WestBromStar	11	0	16	86	4	West Bromwich, England	Your one-stop-shop for the latest news, business, sport and entertainment in West Bromwich. *retweets not the views of WB Star News	2018-02-18 16:11:42	965943868809236481	2018-02-20 13:38:59	2	Could the importance of 'losing face' in Chinese culture encourage Guochuan Lai to sharpen his knives again? #wba https://t.co/l1XO2mkLKh	142297716	
965819085425651712	2018-02-20 05:23:08	0	RT @BeijingPalmer: CGTN correspondent defends racist new year skit as 'Chinese culture,' attacks BBC. Remember, censorship culture doesn't	864532695350743042	Christine Francis	KostyaRjc	17	0	31	168	155		Do you like me?  http://qo2url.info/KostyaRjctukz	2017-05-16 17:27:11	964873092257398790	2018-02-17 14:44:06	14	CGTN correspondent defends racist new year skit as 'Chinese culture,' attacks BBC. Remember, censorship culture doe https://t.co/nvd6t5PggR	1254412448	
966380316808982528	2018-02-21 18:33:16	0	RT @EvaFMM: 2. Using students to gathering intelligence for the evil regime! 3. They teach twisted Chinese Culture to our youth, they are n	893886756101046272	Braveheart	eyMwK99tuWvvR84	243	0	5134	436	7283			2017-08-05 17:29:45	966375022301298688	2018-02-21 18:12:14	1	2. Using students to gathering intelligence for the evil regime! 3. They teach twisted Chinese Culture to our youth https://t.co/OTeANPpJO4	875844127237079040	
966577936152256512	2018-02-22 07:38:32	0	if there's one thing I have to criticize about Chinese culture, it's our tendency to lionize the rich and to presen https://t.co/g56KLTFRsT	140775211	Husker 'YROFTHDG' Fu	HuskerFu	101	1	1291	399	9408		What's up everybody, I THINK DOGS SHOULD VOTE. chinese malaysian, 32, they/she/he - http://husker-fu.tumblr.com	2010-05-06 10:17:39						
966488781732790273	2018-02-22 01:44:16	0	RT @maree_jun: Learn more about Chinese culture - Isn't Dalai Lama and Tibetans part of the Chinese culture?  Bowing to pressure from Chi	119107923	lebao wu	MerlotN	8528	103	63035	1538	1963	Canberra, Australian Capital T	   a student in ANU, refugee Email : wlub86@gmail.com	2010-03-02 18:01:59	966194552670474242	2018-02-21 06:15:07	2	Learn more about Chinese culture - Isn't Dalai Lama and Tibetans part of the Chinese culture?  Bowing to pressure https://t.co/4bQ1xX5Ilk	770256742546493444	
