id	created_at	retweet_count	text	user_id	user_name	user_screen_name	user_followers_count	user_listed_count	user_statuses_count	user_friends_count	user_favourites_count	user_location	user_desc	user_created_at	retweeted_status_id	retweeted_status_created_at	retweeted_status_retweet_count	retweeted_status_text	retweeted_status_user_id
990593089982091264	2018-04-29 14:06:11	0	RT @daumkeziah: To everyone causing so much negativity: I mean no disrespect to the Chinese culture. Im simply showing my appreciation to	1349460781	Alex Joya	KxngJova	264	4	24224	193	3777		My instagram has the same username as here. I am an actor, philosopher, musician, corporatist, Nationalist, and dreamer. That is all.	2013-04-13 15:00:50	990255923598786560	2018-04-28 15:46:24	1006	To everyone causing so much negativity: I mean no disrespect to the Chinese culture. Im simply showing my apprecia https://t.co/ByvuZ2b9VN	2842576303	
990591341330616321	2018-04-29 13:59:14	0	RT @daumkeziah: To everyone causing so much negativity: I mean no disrespect to the Chinese culture. Im simply showing my appreciation to	2828425213	lancer	aguyfromtx	5064	66	83	3998	244	The Republic of Texas	contrary to ordinary - i follow the smart kids	2014-09-23 16:58:47	990255923598786560	2018-04-28 15:46:24	987	To everyone causing so much negativity: I mean no disrespect to the Chinese culture. Im simply showing my apprecia https://t.co/ByvuZ2b9VN	2842576303	
990591395684499456	2018-04-29 13:59:27	0	RT @daumkeziah: To everyone causing so much negativity: I mean no disrespect to the Chinese culture. Im simply showing my appreciation to	753588490886000640	Ather	TheGlacialAther	21	0	3068	64	3941		If I Ever Lose My Faith	2016-07-14 13:54:32	990255923598786560	2018-04-28 15:46:24	988	To everyone causing so much negativity: I mean no disrespect to the Chinese culture. Im simply showing my apprecia https://t.co/ByvuZ2b9VN	2842576303	
990592771625959424	2018-04-29 14:04:55	0	RT @daumkeziah: To everyone causing so much negativity: I mean no disrespect to the Chinese culture. Im simply showing my appreciation to	771494097232080896	Clint Whitaker	ClintWhitaker_	22	0	120	21	497	Murrieta, CA		2016-09-01 23:45:01	990255923598786560	2018-04-28 15:46:24	1001	To everyone causing so much negativity: I mean no disrespect to the Chinese culture. Im simply showing my apprecia https://t.co/ByvuZ2b9VN	2842576303	
990592783793745920	2018-04-29 14:04:58	0	Don't strip me of my Chinese culture  [A Qipao worn by a white person is cultural appropriation]  -Someone goin https://t.co/eWDsCykk3R	74717978	Thank you  Ban   	Shinden9	189	4	6727	528	15085	New Hampshire	| Kill La Kill and KanColle fan. | The other Tohno-chan admin | 	2009-09-16 12:26:29						
990584986850873344	2018-04-29 13:33:59	0	RT @daumkeziah: To everyone causing so much negativity: I mean no disrespect to the Chinese culture. Im simply showing my appreciation to	831284642028285952	Marcus Holloway	InfinitelyRetr0	18	0	666	66	2276	San Francisco, CA		2017-02-13 23:31:17	990255923598786560	2018-04-28 15:46:24	910	To everyone causing so much negativity: I mean no disrespect to the Chinese culture. Im simply showing my apprecia https://t.co/ByvuZ2b9VN	2842576303	
990534810375524352	2018-04-29 10:14:36	0	RT @daumkeziah: To everyone causing so much negativity: I mean no disrespect to the Chinese culture. Im simply showing my appreciation to	727164314868654080	Lucifer	King_of_Belgium	116	0	558	351	13780	Belgium	Songwriter, I dabble in poems, music is essential  #AKF #SPNFamily  Law Student @Ghent University	2016-05-02 15:54:17	990255923598786560	2018-04-28 15:46:24	705	To everyone causing so much negativity: I mean no disrespect to the Chinese culture. Im simply showing my apprecia https://t.co/ByvuZ2b9VN	2842576303	
990587612380520449	2018-04-29 13:44:25	0	RT @anxstxcxa: If you want to appreciate the Chinese culture, visit museums, learn Mandarin, fucking go eat dim sum, but do not wear our hi	803986985123647488	Laura Yiu	laurayiuu	20	0	38	115	34	Toronto, Ontario	toronto.artist.badbitchpugenthusiast  	2016-11-30 15:40:09	990485207504465920	2018-04-29 06:57:30	1	If you want to appreciate the Chinese culture, visit museums, learn Mandarin, fucking go eat dim sum, but do not we https://t.co/Yob0mGfKDd	767177776948514817	
990589323954159617	2018-04-29 13:51:13	0	RT @daumkeziah: To everyone causing so much negativity: I mean no disrespect to the Chinese culture. Im simply showing my appreciation to	11296552	SHA me a river 	nathansu	123	3	9341	325	8301	Los Angeles		2007-12-18 15:08:51	990255923598786560	2018-04-28 15:46:24	964	To everyone causing so much negativity: I mean no disrespect to the Chinese culture. Im simply showing my apprecia https://t.co/ByvuZ2b9VN	2842576303	
990586517671370752	2018-04-29 13:40:04	0	RT @daumkeziah: To everyone causing so much negativity: I mean no disrespect to the Chinese culture. Im simply showing my appreciation to	2300169582	ask the NSA	ImDudeLiberty	2607	27	28275	2594	63804	Now I'm Down In It	I am the love child of Ayn Rand and Mark Levin. I'm a Conservative not (R). I am mine. #Federalist #ConventionOfStates #Liberty Chances are I don't like you. 	2014-01-19 19:00:08	990255923598786560	2018-04-28 15:46:24	927	To everyone causing so much negativity: I mean no disrespect to the Chinese culture. Im simply showing my apprecia https://t.co/ByvuZ2b9VN	2842576303	
990600920781262848	2018-04-29 14:37:18	0	RT @daumkeziah: To everyone causing so much negativity: I mean no disrespect to the Chinese culture. Im simply showing my appreciation to	1069049940	Luke King	lukeking34	230	1	10399	365	899	London	LSE Politics Student	2013-01-07 19:24:18	990255923598786560	2018-04-28 15:46:24	1133	To everyone causing so much negativity: I mean no disrespect to the Chinese culture. Im simply showing my apprecia https://t.co/ByvuZ2b9VN	2842576303	
990505106935304192	2018-04-29 08:16:34	0	RT @daumkeziah: To everyone causing so much negativity: I mean no disrespect to the Chinese culture. Im simply showing my appreciation to	947008244492505088	MapleBishopFan1985	XianghuaXiaoFan	35	0	7363	36	9735	Old Forge, PA		2017-12-30 07:35:34	990255923598786560	2018-04-28 15:46:24	616	To everyone causing so much negativity: I mean no disrespect to the Chinese culture. Im simply showing my apprecia https://t.co/ByvuZ2b9VN	2842576303	
990499721323016192	2018-04-29 07:55:10	0	RT @daumkeziah: To everyone causing so much negativity: I mean no disrespect to the Chinese culture. Im simply showing my appreciation to	2706376040	Ben Glasby	BenGlasby1	61	0	1110	228	2116			2014-08-04 11:39:28	990255923598786560	2018-04-28 15:46:24	608	To everyone causing so much negativity: I mean no disrespect to the Chinese culture. Im simply showing my apprecia https://t.co/ByvuZ2b9VN	2842576303	
990601616981143552	2018-04-29 14:40:04	0	Everyone worried about the scourge of Chinese-culture-appropriation will be glad to hear that the Kung Pao chicken https://t.co/hmhrnMv7KO	904695117352759297	Recontextualize This	Ramcgreg	63	2	2635	107	2291		Conservative liberal who thinks the word conservative makes a better adjective than a noun and other equally deep and provocative things. retweet = retweet	2017-09-04 13:18:19						
990601734870487040	2018-04-29 14:40:32	0	RT @daumkeziah: To everyone causing so much negativity: I mean no disrespect to the Chinese culture. Im simply showing my appreciation to	165940622	Billy	BillyThaGOAT	747	4	27116	1926	7735	Between Time and Space 	Lifter, Avid Reader, Conservative, 2A, MAGA, Deplorable, USMC, and a Man of Science	2010-07-12 23:06:48	990255923598786560	2018-04-28 15:46:24	1161	To everyone causing so much negativity: I mean no disrespect to the Chinese culture. Im simply showing my apprecia https://t.co/ByvuZ2b9VN	2842576303	
990600597966471168	2018-04-29 14:36:01	0	RT @daumkeziah: To everyone causing so much negativity: I mean no disrespect to the Chinese culture. Im simply showing my appreciation to	114691507	Johny Walkr\_()_/	riteshpali	956	26	135482	413	128325	LA	Indian,concerned citizen,occasionally disillusioned,never hopeless..Ritesh Pali's official acct (not tht anyone wud care to create a fake one) RT != Endorsement	2010-02-16 08:48:28	990255923598786560	2018-04-28 15:46:24	1118	To everyone causing so much negativity: I mean no disrespect to the Chinese culture. Im simply showing my apprecia https://t.co/ByvuZ2b9VN	2842576303	
990507531188523009	2018-04-29 08:26:12	0	RT @daumkeziah: To everyone causing so much negativity: I mean no disrespect to the Chinese culture. Im simply showing my appreciation to	2521276562	no Ls 	NoTheGoatxx	2043	9	43247	1297	26044	so nasty...so rude 	Noel  | twin sister: @ilahi__ | 20 #southernnotstate	2014-05-24 20:22:16	990255923598786560	2018-04-28 15:46:24	628	To everyone causing so much negativity: I mean no disrespect to the Chinese culture. Im simply showing my apprecia https://t.co/ByvuZ2b9VN	2842576303	
990602183312887809	2018-04-29 14:42:19	0	RT @daumkeziah: To everyone causing so much negativity: I mean no disrespect to the Chinese culture. Im simply showing my appreciation to	790960259435261952	Bob Ronin	BobRoninLive	35	0	544	27	1022	Brooklyn, NY		2016-10-25 16:56:36	990255923598786560	2018-04-28 15:46:24	1169	To everyone causing so much negativity: I mean no disrespect to the Chinese culture. Im simply showing my apprecia https://t.co/ByvuZ2b9VN	2842576303	
990506997710647296	2018-04-29 08:24:05	0	RT @daumkeziah: To everyone causing so much negativity: I mean no disrespect to the Chinese culture. Im simply showing my appreciation to	2886004526	14yn	2ak_14	360	6	26259	724	15915	a.k.a.prefecture		2014-11-01 08:19:20	990255923598786560	2018-04-28 15:46:24	624	To everyone causing so much negativity: I mean no disrespect to the Chinese culture. Im simply showing my apprecia https://t.co/ByvuZ2b9VN	2842576303	
990506785126531073	2018-04-29 08:23:14	0	RT @daumkeziah: To everyone causing so much negativity: I mean no disrespect to the Chinese culture. Im simply showing my appreciation to	303763981	Kendall 	ichaBABE	654	8	40101	674	46953	Manila	kunwari strong pero magbbreakdown in 5, 4, 3, 2, 1...	2011-05-23 11:43:01	990255923598786560	2018-04-28 15:46:24	623	To everyone causing so much negativity: I mean no disrespect to the Chinese culture. Im simply showing my apprecia https://t.co/ByvuZ2b9VN	2842576303	
990507971036827648	2018-04-29 08:27:57	0	RT @daumkeziah: To everyone causing so much negativity: I mean no disrespect to the Chinese culture. Im simply showing my appreciation to	1189801075	Alex is a fake betch	Sweetcherry_ash	2667	44	28642	2642	58229	Ashtons ass	when youre in outer space @wayfanna | Supporting { Fan account }| Admin of: @LittleMix_FH	2013-02-17 15:08:16	990255923598786560	2018-04-28 15:46:24	630	To everyone causing so much negativity: I mean no disrespect to the Chinese culture. Im simply showing my apprecia https://t.co/ByvuZ2b9VN	2842576303	
990582096526790656	2018-04-29 13:22:30	0	RT @daumkeziah: To everyone causing so much negativity: I mean no disrespect to the Chinese culture. Im simply showing my appreciation to	780110359176839168	1996	Sanguine_Jaguar	91	0	712	644	4046	France	I  Trash & Gold	2016-09-25 18:22:58	990255923598786560	2018-04-28 15:46:24	893	To everyone causing so much negativity: I mean no disrespect to the Chinese culture. Im simply showing my apprecia https://t.co/ByvuZ2b9VN	2842576303	
990513612094562304	2018-04-29 08:50:22	0	RT @baekbunee: @tubirfess as for me no, this is in no way disrespecting chinese culture because MANY wore cheongsam for different reasons a	4924905962		lovedoesntalk	229	0	17198	225	482	Jakarta Capital Region, IND.	And the yellow sunflower by the brook, in autumn beauty stood.	2016-02-18 09:45:55	990513216470970368	2018-04-29 08:48:48	1	@tubirfess as for me no, this is in no way disrespecting chinese culture because MANY wore cheongsam for different https://t.co/RDMyNYUqpP	871289715181223936	
990529274443681792	2018-04-29 09:52:36	0	RT @daumkeziah: To everyone causing so much negativity: I mean no disrespect to the Chinese culture. Im simply showing my appreciation to	380041181	Kaiju	CobieWayne93	1125	17	105504	624	19596	Texas, USA	AMOSC: Cobiewayne93	2011-09-26 00:07:15	990255923598786560	2018-04-28 15:46:24	694	To everyone causing so much negativity: I mean no disrespect to the Chinese culture. Im simply showing my apprecia https://t.co/ByvuZ2b9VN	2842576303	
990480159160655872	2018-04-29 06:37:26	0	RT @daumkeziah: To everyone causing so much negativity: I mean no disrespect to the Chinese culture. Im simply showing my appreciation to	3147246073	DankLordCabrn	DankLordCabron	81	2	5645	130	2337	West Coast	Bored.	2015-04-10 06:07:51	990255923598786560	2018-04-28 15:46:24	554	To everyone causing so much negativity: I mean no disrespect to the Chinese culture. Im simply showing my apprecia https://t.co/ByvuZ2b9VN	2842576303	
990523289234739200	2018-04-29 09:28:49	0	RT @daumkeziah: To everyone causing so much negativity: I mean no disrespect to the Chinese culture. Im simply showing my appreciation to	622967385	Marwan Al-obaidi	BlasterClone	491	3	3090	3868	47868	Uusimaa, Suomi	Also known as BlasterClone & RD2D4. A Sith Sorceror, Fury Warrior and Spartan. Hardcore fan of Star Wars, Warcraft and Halo. Wahhabis, ISIS, and Feminism=cancer	2012-06-30 15:07:17	990255923598786560	2018-04-28 15:46:24	669	To everyone causing so much negativity: I mean no disrespect to the Chinese culture. Im simply showing my apprecia https://t.co/ByvuZ2b9VN	2842576303	
990488136194109440	2018-04-29 07:09:08	0	RT @daumkeziah: To everyone causing so much negativity: I mean no disrespect to the Chinese culture. Im simply showing my appreciation to	750965147003416576	Slump God	SlumpGodCS	144	0	1573	357	3335	Perrysburg, OH	Don't @ me.	2016-07-07 08:10:18	990255923598786560	2018-04-28 15:46:24	586	To everyone causing so much negativity: I mean no disrespect to the Chinese culture. Im simply showing my apprecia https://t.co/ByvuZ2b9VN	2842576303	
990475498550513666	2018-04-29 06:18:55	0	RT @daumkeziah: To everyone causing so much negativity: I mean no disrespect to the Chinese culture. Im simply showing my appreciation to	711397181798752256	bitchcracker	heyrachcruz	408	2	15884	206	18716	Caloocan City	aquarius &  & studying at iAcademy	2016-03-20 03:41:20	990255923598786560	2018-04-28 15:46:24	542	To everyone causing so much negativity: I mean no disrespect to the Chinese culture. Im simply showing my apprecia https://t.co/ByvuZ2b9VN	2842576303	
990536521571753986	2018-04-29 10:21:24	0	RT @daumkeziah: To everyone causing so much negativity: I mean no disrespect to the Chinese culture. Im simply showing my appreciation to	239762746	Yu Jing	tequilasouls	135	3	69501	139	299		boo	2011-01-18 11:09:07	990255923598786560	2018-04-28 15:46:24	710	To everyone causing so much negativity: I mean no disrespect to the Chinese culture. Im simply showing my apprecia https://t.co/ByvuZ2b9VN	2842576303	
990481773678219265	2018-04-29 06:43:51	0	RT @IonaItalia: You: Other cultures aren't a costume, REEEEEEEEEEE!   Also you: this style of dress is the sum total of Chinese culture.	2822712590	Transparent Blurb (barely visible)	Mislu_Kravin	1578	284	354808	1103	368627	same ole place	Don't bother	2014-09-20 20:25:58	990325299857510400	2018-04-28 20:22:05	4	You: Other cultures aren't a costume, REEEEEEEEEEE!   Also you: this style of dress is the sum total of Chinese https://t.co/TmseMI0ONI	1382974668	
990488044909350912	2018-04-29 07:08:46	0	RT @JewAndA_HalfMen: Thank god Jeremy Lam saved the Chinese culture from the scourge of 17 year old schoolchildren	993862729	Stealth	__Stealth_	85	0	8032	368	35329	hellhole rock in space	Human Extinction Supporter, Anti-Life, Anti-Theist, Not Tribal. Intolerant of stupidity.  #GiantAsteroid2020 #NoLivesMatter Everyone is created equally flawed.	2012-12-06 21:22:53	990463046903586817	2018-04-29 05:29:26	16	Thank god Jeremy Lam saved the Chinese culture from the scourge of 17 year old schoolchildren	2996072589	
990534026325831681	2018-04-29 10:11:29	0	RT @daumkeziah: To everyone causing so much negativity: I mean no disrespect to the Chinese culture. Im simply showing my appreciation to	749322180320698369	Lazyman	el_espia_vago	15	0	2061	50	387			2016-07-02 19:21:44	990255923598786560	2018-04-28 15:46:24	704	To everyone causing so much negativity: I mean no disrespect to the Chinese culture. Im simply showing my apprecia https://t.co/ByvuZ2b9VN	2842576303	
990503034223394819	2018-04-29 08:08:20	0	RT @daumkeziah: To everyone causing so much negativity: I mean no disrespect to the Chinese culture. Im simply showing my appreciation to	134533801		mkwm80	721	18	61595	764	35755		http://yotsuba4ever.blog.fc2.com ()	2010-04-18 18:06:57	990255923598786560	2018-04-28 15:46:24	613	To everyone causing so much negativity: I mean no disrespect to the Chinese culture. Im simply showing my apprecia https://t.co/ByvuZ2b9VN	2842576303	
990527336142565376	2018-04-29 09:44:54	0	RT @daumkeziah: To everyone causing so much negativity: I mean no disrespect to the Chinese culture. Im simply showing my appreciation to	14639500	Thomas J. Quinlan	thomas_quinlan	1764	298	45043	574	576	London, UK	Proud husband of Wendy & father of Maxwell. Adventures in Cybersecurity: http://amzn.to/1guk7Tx Upcoming book: https://v.gd/yR5RlV  sayhi@thomasquinlan.com	2008-05-03 17:04:13	990255923598786560	2018-04-28 15:46:24	691	To everyone causing so much negativity: I mean no disrespect to the Chinese culture. Im simply showing my apprecia https://t.co/ByvuZ2b9VN	2842576303	
990477075864784896	2018-04-29 06:25:11	0	RT @daumkeziah: To everyone causing so much negativity: I mean no disrespect to the Chinese culture. Im simply showing my appreciation to	4848732394	Wage Gap Myth	GenderGapMyth	12	0	1100	93	44	Gender Studies Department	I am the Gender Wage Gap. I am a Myth.	2016-01-26 07:15:12	990255923598786560	2018-04-28 15:46:24	550	To everyone causing so much negativity: I mean no disrespect to the Chinese culture. Im simply showing my apprecia https://t.co/ByvuZ2b9VN	2842576303	
990474374766628864	2018-04-29 06:14:27	0	RT @daumkeziah: To everyone causing so much negativity: I mean no disrespect to the Chinese culture. Im simply showing my appreciation to	140486951	La Mtisse Claire 	babnigga	2411	55	88161	478	2015	Shiganshina	If youre reading this youre cancelled	2010-05-05 16:27:25	990255923598786560	2018-04-28 15:46:24	535	To everyone causing so much negativity: I mean no disrespect to the Chinese culture. Im simply showing my apprecia https://t.co/ByvuZ2b9VN	2842576303	
990541790330605568	2018-04-29 10:42:20	0	RT @daumkeziah: To everyone causing so much negativity: I mean no disrespect to the Chinese culture. Im simply showing my appreciation to	1338549270	Beyy 	Schayangz	3935	90	116816	2145	147745	Singapore	 to  | I feel like I relate to this on some sort of level	2013-04-09 07:33:04	990255923598786560	2018-04-28 15:46:24	733	To everyone causing so much negativity: I mean no disrespect to the Chinese culture. Im simply showing my apprecia https://t.co/ByvuZ2b9VN	2842576303	
990554817411125249	2018-04-29 11:34:06	0	RT @daumkeziah: To everyone causing so much negativity: I mean no disrespect to the Chinese culture. Im simply showing my appreciation to	442067714	Shea	SheamusCogan	299	15	4179	607	2713	Lincoln	Interested in psychology, fitness, problem solving & most any perspective that challenges our assumptions. Quite like Guinness, food & random Qs	2011-12-20 18:27:06	990255923598786560	2018-04-28 15:46:24	775	To everyone causing so much negativity: I mean no disrespect to the Chinese culture. Im simply showing my apprecia https://t.co/ByvuZ2b9VN	2842576303	
990546852524290048	2018-04-29 11:02:27	0	RT @daumkeziah: To everyone causing so much negativity: I mean no disrespect to the Chinese culture. Im simply showing my appreciation to	741742786278531072	x	gablmb	104	0	9218	405	21318		Snap: gablmb #nohomo	2016-06-11 21:23:55	990255923598786560	2018-04-28 15:46:24	752	To everyone causing so much negativity: I mean no disrespect to the Chinese culture. Im simply showing my apprecia https://t.co/ByvuZ2b9VN	2842576303	
990485804018552832	2018-04-29 06:59:52	0	RT @daumkeziah: To everyone causing so much negativity: I mean no disrespect to the Chinese culture. Im simply showing my appreciation to	833441931602620418	dexter1234	dexter123455	30	1	3604	76	10825			2017-02-19 22:23:36	990255923598786560	2018-04-28 15:46:24	579	To everyone causing so much negativity: I mean no disrespect to the Chinese culture. Im simply showing my apprecia https://t.co/ByvuZ2b9VN	2842576303	
990483820196573186	2018-04-29 06:51:59	0	RT @IonaItalia: You: Other cultures aren't a costume, REEEEEEEEEEE!   Also you: this style of dress is the sum total of Chinese culture.	376533118	Sebastian Munoz	sebastianmuno10	680	24	32382	5003	76136	Hamilton, Ontario	a slacker i am	2011-09-20 01:53:11	990325299857510400	2018-04-28 20:22:05	6	You: Other cultures aren't a costume, REEEEEEEEEEE!   Also you: this style of dress is the sum total of Chinese https://t.co/TmseMI0ONI	1382974668	
990482751085215744	2018-04-29 06:47:44	0	RT @daumkeziah: To everyone causing so much negativity: I mean no disrespect to the Chinese culture. Im simply showing my appreciation to	3053007942	Logan Serrano	logan7serrano	304	1	2095	300	2785	Lobo Field/LCHS Choir Room	@katie_eugenio ////////////////////////////LANGHAM CREEK BASEBALL / A CAPELLA CHOIR sc: logan_serrano	2015-03-01 16:54:14	990255923598786560	2018-04-28 15:46:24	564	To everyone causing so much negativity: I mean no disrespect to the Chinese culture. Im simply showing my apprecia https://t.co/ByvuZ2b9VN	2842576303	
990482780034187265	2018-04-29 06:47:51	0	if u have some fuckin respect to chinese culture gen you would LISTEN TO CHINESE PEOPLE THEMSELVES SAYING ITS WRONG https://t.co/p7KTyzdken	783847738899206144	  ` 	lotisflowers	545	24	3565	196	6149		17.	2016-10-06 01:53:58						
990567031455080448	2018-04-29 12:22:38	0	RT @daumkeziah: To everyone causing so much negativity: I mean no disrespect to the Chinese culture. Im simply showing my appreciation to	2447709852	Jaden	MysteryNoone	149	7	13229	814	15944	Deutschland	Always wants to die and live forever at the same time 	2014-04-16 18:02:09	990255923598786560	2018-04-28 15:46:24	825	To everyone causing so much negativity: I mean no disrespect to the Chinese culture. Im simply showing my apprecia https://t.co/ByvuZ2b9VN	2842576303	
990500316238856192	2018-04-29 07:57:32	0	RT @ChinaDailyUSA: The birth of black tea  #Chineseculture #tea https://t.co/Az67amotBS	914650400350859265	Jane	Jane96458906	5	0	303	67	161			2017-10-02 00:37:03	990417925294231552	2018-04-29 02:30:09	15	The birth of black tea  #Chineseculture #tea https://t.co/Az67amotBS	87775422	
990506805447962624	2018-04-29 08:23:19	0	RT @JewAndA_HalfMen: Thank god Jeremy Lam saved the Chinese culture from the scourge of 17 year old schoolchildren	948438590953988096	unoriginalname	l1tc4ndl3	16	0	4008	173	7794			2018-01-03 06:19:16	990463046903586817	2018-04-29 05:29:26	18	Thank god Jeremy Lam saved the Chinese culture from the scourge of 17 year old schoolchildren	2996072589	
990506503550337025	2018-04-29 08:22:07	0	RT @daumkeziah: To everyone causing so much negativity: I mean no disrespect to the Chinese culture. Im simply showing my appreciation to	3255180499	I am not gonna see infinity wars	X_EdBoi_X	340	8	21933	243	13409	North Las Vegas, NV	My girlfriend hates my twitter! I can prove it look @astrolatte / I enjoy playing video games and D&D!	2015-06-25 02:43:58	990255923598786560	2018-04-28 15:46:24	620	To everyone causing so much negativity: I mean no disrespect to the Chinese culture. Im simply showing my apprecia https://t.co/ByvuZ2b9VN	2842576303	
990506536874266624	2018-04-29 08:22:15	0	RT @daumkeziah: To everyone causing so much negativity: I mean no disrespect to the Chinese culture. Im simply showing my appreciation to	26799637	Ron Murphy	ronmurp	433	17	36108	1604	11464	Manchester	Secular humanist atheist	2009-03-26 17:30:48	990255923598786560	2018-04-28 15:46:24	621	To everyone causing so much negativity: I mean no disrespect to the Chinese culture. Im simply showing my apprecia https://t.co/ByvuZ2b9VN	2842576303	
990584487514984449	2018-04-29 13:32:00	0	RT @daumkeziah: To everyone causing so much negativity: I mean no disrespect to the Chinese culture. Im simply showing my appreciation to	491841277	Bobby Boucher Jr.	GunnerEverett	172	2	4143	315	7987	Lincoln, NE	Can sneeze with eyes open                                                                 Husker Football, and Haylee Cross.	2012-02-14 02:32:32	990255923598786560	2018-04-28 15:46:24	905	To everyone causing so much negativity: I mean no disrespect to the Chinese culture. Im simply showing my apprecia https://t.co/ByvuZ2b9VN	2842576303	
990583925377589248	2018-04-29 13:29:46	0	@nahjoonah @elisabethlehem @Fart_Sparkles @JeannieBeanie99 @daumkeziah ahh, a part of chinese culture Yet the chine https://t.co/Ga6IveHi6w	1594548300	SaturnFX	SaturnFX	290	15	18077	468	2022		FOLLOWS YOU	2013-07-15 00:23:55						
990643111482281989	2018-04-29 17:24:57	0	RT @daumkeziah: To everyone causing so much negativity: I mean no disrespect to the Chinese culture. Im simply showing my appreciation to	4769452883	Astrico	14Astrico	145	3	12295	209	19278		Ilustrador con ambicin de mejorar y estudiante de Diseo de Img. y Sonido. Soy Astrico Catorce en face y Astrico14 en Ask (Kaiji argentino superior k|:^|)	2016-01-11 01:07:24	990255923598786560	2018-04-28 15:46:24	2204	To everyone causing so much negativity: I mean no disrespect to the Chinese culture. Im simply showing my apprecia https://t.co/ByvuZ2b9VN	2842576303	
