id	created_at	retweet_count	text	user_id	user_name	user_screen_name	user_followers_count	user_listed_count	user_statuses_count	user_friends_count	user_favourites_count	user_location	user_desc	user_created_at	retweeted_status_id	retweeted_status_created_at	retweeted_status_retweet_count	retweeted_status_text	retweeted_status_user_id
963782700472655872	2018-02-14 14:31:16	0	RT @TheMEAA: Happy #ValentinesDay! In Chinese culture, mandarin ducks are considered symbols of love, so its only fitting that there are tw	781208958702907392	ChinaX	chinaxharvard	400	27	1298	175	541		Chinas cultural, economic, political & social transformation past, present & future. https://www.edx.org/chinax-chinas-past-present-future	2016-09-28 19:08:24	963745927017254914	2018-02-14 12:05:09	1	Happy #ValentinesDay! In Chinese culture, mandarin ducks are considered symbols of love, so its only fitting that t https://t.co/omWU9WKyaL	1851103482	
963631625392328704	2018-02-14 04:30:57	0	Theme: Chinese New Year    According to Chinese culture, noodles should not be cut as it symbolises longevity and https://t.co/ixQCcI62BZ	2607252439	Beyond Norm	BeyondNormBlog	61	0	578	52	199		Follow us on our socials @BeyondNormBlog! x	2014-07-06 10:18:07						
963528895969538050	2018-02-13 21:42:44	0	Towson students! The Chinese Culture Club is selling origami roses w/ 2 chocolates for $1 outside PAWs! #towson https://t.co/29bUoOv9Ux	2839390387	Treasureeee 	Treas_Bunny98	363	0	1905	448	3259	Inside my head	When life gives you lemons... don't make anything, just eat the damn lemon	2014-10-03 20:42:29						
964002687669981184	2018-02-15 05:05:25	0	RT @TuttleBooks: Take the whole family on a whirlwind tour of Chinese culture and history with this award-winning, delightfully illustrated	16023311	Linda Austin	moonbridgebooks	1616	151	16062	1389	1046	St. Louis, MO	Cherry Blossoms in Twilight, Battlefield Doc - Write your past for the future. Love history & cultures (esp Japan), poetry and cats. Cats are poetry.	2008-08-28 04:40:12	964001390958972928	2018-02-15 05:00:16	1	Take the whole family on a whirlwind tour of Chinese culture and history with this award-winning, delightfully illu https://t.co/59t8hOggkk	730798262	
963994634153213952	2018-02-15 04:33:25	0	RT @caratmilk: [17 WEIBO UPDATE] [TRANS] [17'S] 2018 Eight Eight is make a fortune // In Chinese culture, the number 8 is a lucky number an	794907983809363968	heira 	shxngnim_twt	641	1	7330	929	4739	jei - yem	 bts // straykids // svt	2016-11-05 14:23:26	963994607926198273	2018-02-15 04:33:19	1	[17 WEIBO UPDATE] [TRANS] [17'S] 2018 Eight Eight is make a fortune // In Chinese culture, the number 8 is a lucky https://t.co/qh2jJfsCPn	890994434271133696	
963994835437826049	2018-02-15 04:34:13	0	RT @caratmilk: [17 WEIBO UPDATE] [TRANS] [17'S] 2018 Eight Eight is make a fortune // In Chinese culture, the number 8 is a lucky number an	139632595	hanagyu 	fatalmingyu	1493	16	45082	608	7245	+60	*:.. o @pledis_17 & @weareoneEXO o ..:*	2010-05-03 06:20:31	963994607926198273	2018-02-15 04:33:19	2	[17 WEIBO UPDATE] [TRANS] [17'S] 2018 Eight Eight is make a fortune // In Chinese culture, the number 8 is a lucky https://t.co/qh2jJfsCPn	890994434271133696	
963555395691261952	2018-02-13 23:28:02	0	Celebrating Chinese culture @uochester with some fantastic performances, delicious food and brilliant interactive a https://t.co/iQvEcnUyuE	98388128	Cherelle Mitchell	cherelleLouiseM	1604	11	4771	1089	5069	Chester, England	@ChesterSU Prez Snapchat: SUPresident  Mental Health & Wellbeing | Media | Communication || Peace | 	2009-12-21 14:15:52						
964069830348468225	2018-02-15 09:32:13	0	Experience the rich and real Chinese culture while enriching your life e... - #Guizhou , China (https://t.co/9IXXC3OT60) ESLemployment	17815954	ESLAsia	ESLAsia	295	17	25666	0	0			2008-12-02 19:30:41						
964052926770462720	2018-02-15 08:25:03	0	Family gathering is very important in Chinese culture. Everyone should be at home during the Lunar New Year. #CNY2018	66933263	Chino Chow 	akoMrChow	202	7	1333	245	395	Baguio City	Radio Host/DJ/Broadcaster/Foodie/Blogger/Artist	2009-08-19 06:47:19						
963300535934873600	2018-02-13 06:35:19	0	RT @parlabest: China forcing Uyghurs decorate their main doors with the ethnic Han Chinese culture https://t.co/8sULxQ9OSn	770306235606372352	benzer la squale	benzer974	71	3	4226	138	454		pronostics sur a 10%	2016-08-29 17:04:52	963295856228290560	2018-02-13 06:16:43	2	China forcing Uyghurs decorate their main doors with the ethnic Han Chinese culture https://t.co/8sULxQ9OSn	56995153	
963313756330713088	2018-02-13 07:27:51	0	RT @parlabest: China forcing Uyghurs decorate their main doors with the ethnic Han Chinese culture https://t.co/8sULxQ9OSn	2972095817	7Luyghur	7Luyghur1	721	17	11125	2077	33	Bruxelles, Belgique	uyghur Mit 20 hat jeder das Gesicht, das Gott ihm gegeben hat; mit 40 das Gesicht, das ihm das Leben gegeben hat; und mit 60 das Gesicht, das er verdient.	2015-01-10 21:37:32	963295856228290560	2018-02-13 06:16:43	3	China forcing Uyghurs decorate their main doors with the ethnic Han Chinese culture https://t.co/8sULxQ9OSn	56995153	
963377113960099840	2018-02-13 11:39:37	0	Lion dance is a form of traditional dance in Chinese culture which symbolizes good luck and great fortune. Embrace https://t.co/LW3Ny46SDt	70931873	City Garden	CityGardenHK	115	7	832	54	0	9 City Garden Road, Hong Kong	The stylish and comfortably appointed Hong Kong City Garden Hotel offers 613 elegantly furnished Hong Kong hotel rooms and suites.	2009-09-02 10:23:21						
963391460526706693	2018-02-13 12:36:37	0	RT @Richtopia: How China Is Making Sizeable Investments in the UK https://t.co/YoT7iundjd #chinadaily #chineseculture https://t.co/uhGDnQsi	4434992477	Luis Delias	ledensebelm	19	1	638	3	581	Fort Lauderdale, Florida	#Venezuelan music blending traditional  South American rhythms with jazz and rock! Follow La #Rockamaya to the land of #Joropo! https://t.co/1GjVfTBY55	2015-12-10 07:04:32	963382256533356544	2018-02-13 12:00:03	2	How China Is Making Sizeable Investments in the UK https://t.co/YoT7iundjd #chinadaily #chineseculture https://t.co/uhGDnQsiCG	2926600120	
963343573730017282	2018-02-13 09:26:20	0	RT @arthur_affect: Fun fact: The Chinese culture-hero and god of war Guan Yu, best known for his role in the Romance of the Three Kingdoms,	2879051030	(((Bob))) Certified Stable Brain Genius	TeamSJW	731	11	30896	878	115577		Antifa Super Soldier. Mean to Nazis, GamerGaters, & MRAs. SO MEAN!	2014-10-27 04:41:38	962989405429424128	2018-02-12 09:59:00	16	Fun fact: The Chinese culture-hero and god of war Guan Yu, best known for his role in the Romance of the Three King https://t.co/3dF8g1SgXV	65260792	
963361219494268928	2018-02-13 10:36:27	0	Steve Hsieh: Gambling is part of the Chinese culture https://t.co/8tqwlZTVkZ	2303622032	WinafyNews	WinafyNews	198	48	58253	13	6	New York, NY	Sports Betting and Online Gambling Industry News. Real-time, 24/7, Top Stories and Insights from across the Globe	2014-01-21 19:48:50						
963348678680473601	2018-02-13 09:46:37	0	RT @parlabest: China forcing Uyghurs decorate their main doors with the ethnic Han Chinese culture https://t.co/8sULxQ9OSn	1501986714	gassal ne demek	gassalnedemek	58	0	5058	227	2812			2013-06-11 11:16:27	963295856228290560	2018-02-13 06:16:43	5	China forcing Uyghurs decorate their main doors with the ethnic Han Chinese culture https://t.co/8sULxQ9OSn	56995153	
963359666515296256	2018-02-13 10:30:17	0	Steve Hsieh: Gambling is part of the Chinese culture https://t.co/8qlY9BdSKt https://t.co/T3rAsxlvg9	241110794	Manfred Rosenberg	4PawShop	5391	45	251369	5921	273	Canada	Our 4PawShop isnt just a pet store. We are pet people, pet lovers and pet parents. We are just like you.	2011-01-21 13:52:36						
963474926782111744	2018-02-13 18:08:17	0	RT @zlj517: Book launch: Zhao Lijian called the book a great effort to introduce Chinese culture to Pakistan. The book was based on deep re	2497931359	Zaeem Ahmed Ch	zaeemahmedch_ch	229	3	12638	398	12714	Lahore,Pakistan	Business Graduate| Entrepreneur | Marketing Analyst| Traveller| Optimistic| CPEC  One Belt One Road|	2014-05-16 07:00:47	958957394536615937	2018-02-01 06:57:14	27	Book launch: Zhao Lijian called the book a great effort to introduce Chinese culture to Pakistan. The book was base https://t.co/xwBJzEQwee	141627220	
963987906804310017	2018-02-15 04:06:41	0	@lorenabuena it's a symbol! it means prosperous business and life. red in Chinese culture symbolizes luck, happines https://t.co/C7xr7FNuNE	743328992430743552	April	taekswerve	94	1	12747	115	584	Seokjins Wallet	 April  she/her  NYC/EST  multifandom mess  sometimes I rp 	2016-06-16 06:26:56						
963438226571714562	2018-02-13 15:42:27	0	RT @AlainaLockhart: Awesome night celebrating diversity with the Multicultural Association of Sussex. Tonights theme was Chinese Culture #	861260877114343424	Jim Hall	halljjim	1948	1	5973	2220	20082	Kji'puktuk (Halifax, NS) 	Injustice anywhere is a threat to justice everywhere. - MLK #ClimateChange #HealthCare #HumanRights #RefugeesWelcome #RightSideOfHistory #SocialJustice #FBR 	2017-05-07 16:46:09	963241352921337856	2018-02-13 02:40:09	4	Awesome night celebrating diversity with the Multicultural Association of Sussex. Tonights theme was Chinese Cultu https://t.co/70cXTkgdAZ	2410630211	
963271188549120000	2018-02-13 04:38:42	0	@Can_Atheist I just love the ego stroking of that premise. Never mind that Chinese culture advanced greatly without abrahamic religion.	842490668547293184	GM Skeptic	gm_skeptic	1231	16	977	62	2039	Texas, USA	Drew | Atheist activist, science advocate, youtuber. 19k+ subs. My tweets contain 100% therapeutic grade skepticism.	2017-03-16 21:40:02						
963273908349751296	2018-02-13 04:49:31	0	The Fighting Arts Show for First time in #saudi #arabia to share the chinese culture with respect.  #MoHEnt https://t.co/33FSLC2f1F	946029927681396737	Mo-H	MoHGlobal	6	0	95	7	0		You're here to know what the People do to make the Happiness all the Time, the Real Meaning of the Global Entertainment and the Top Values of the Arts	2017-12-27 14:48:05						
964137652558573568	2018-02-15 14:01:43	0	#LunarNewYear Eve dinner at my Gramma's house!!!   (PS Lunar New Year in Chinese culture is basically like Th https://t.co/wZRg7rgZ6f	314050107	Renie Strychalski	RenieDraws	1349	44	2951	268	3669	Winterfell	Professional illustrator and comic artist. Gwenpool, SILK, Archer, indie comics.  Blood literally made of coffee. 	2011-06-09 16:46:55						
964469450572484613	2018-02-16 12:00:10	0	Did you know the colour red in Chinese culture symbolises #goodluck? Check out these beautiful #ChineseNewYear insp https://t.co/X0NNIaNS2l	2815141641	Countryside GM	Countryside_GM	2195	20	1965	237	216	Greater Manchester	Building vibrant communities & stunning homes across Greater Manchester.	2014-10-08 12:25:08						
964176860174143488	2018-02-15 16:37:31	0	RT @Gadgets6Cool: @GolukAsia @PadreFamilya @iGoluk Red is the color or symbol of good luck in Chinese culture and is often used for new yea	957559417263796225	Padre De Familia	PadreFamilya	130	0	262	128	350	Houston, TX	Strong, Determine, Responsible, Loving Father & Husband	2018-01-28 10:22:10	964176764703449088	2018-02-15 16:37:08	1	@GolukAsia @PadreFamilya @iGoluk Red is the color or symbol of good luck in Chinese culture and is often used for n https://t.co/pg0IAmi8mY	957553873249554432	
964383044332212224	2018-02-16 06:16:49	0	RT @StoneBridgePub: Chinese New Year is coming up on Friday &amp; it's the Year of the Dog! But, in the context of Chinese culture, what is the	1614549458	Tania Bradkin	TaniaBradkin	2866	112	33150	2355	91119		There's only 1 rule that I know of babies, God damn it you've got 2 b kind~Vonnegut #Mama2twins&CaliB. Psychotherapist. #socialworker #writer #latina	2013-07-23 06:29:12	963601246547533826	2018-02-14 02:30:14	2	Chinese New Year is coming up on Friday &amp; it's the Year of the Dog! But, in the context of Chinese culture, what is https://t.co/4Ac5xtQIiV	16889268	
964275187276328960	2018-02-15 23:08:14	0	RT @caratmilk: [17 WEIBO UPDATE] [TRANS] [17'S] 2018 Eight Eight is make a fortune // In Chinese culture, the number 8 is a lucky number an	955054213901434880	i want to fight you lee seokmin	softejun	53	0	5492	144	864	caratland	your existence brings peace to my mind	2018-01-21 12:27:23	963994607926198273	2018-02-15 04:33:19	9	[17 WEIBO UPDATE] [TRANS] [17'S] 2018 Eight Eight is make a fortune // In Chinese culture, the number 8 is a lucky https://t.co/qh2jJfsCPn	890994434271133696	
964411372711718912	2018-02-16 08:09:23	0	RT @andrewrstine: &gt;a speculative fiction world where westerners are expected to know about chinese culture because china's middle class is	2472817628	EdgeladylikeV	matryoshka_core	84	1	9263	171	4831	Texas, USA	Mostly retweets of random stuff. Undocumented. #govegan.	2014-05-01 17:35:07	964376926440730624	2018-02-16 05:52:31	11	&gt;a speculative fiction world where westerners are expected to know about chinese culture because china's middle cla https://t.co/jTgEz0VGVg	50790536	
964423153895096320	2018-02-16 08:56:12	0	RT @CUPBookshop: Happy #ChineseNewYear.  If you'd like to learn more about Chinese festivals, our Introductions to Chinese Culture series i	319110295	Cambridge Uni Press	CambridgeUP	9302	265	3015	549	742	Cambridge, England	News, events and updates from Cambridge University Press, the world's oldest publisher. Publishing since 1584 - Tweeting since 2014	2011-06-17 15:39:20	964412419903692800	2018-02-16 08:13:33	2	Happy #ChineseNewYear.  If you'd like to learn more about Chinese festivals, our Introductions to Chinese Culture s https://t.co/5jGZZ2lUOT	156304811	
964196929893797888	2018-02-15 17:57:16	0	RT @BritishCouncil: Teachers, here are some resources to help make your classes more aware of Chinese culture as we get ready to celebrate	819277993	Wirral Multilingual	WMultilingual	1477	55	4930	1470	80	Wirral, United Kingdom	Wirral Multilingual promotes the use and understanding of foreign languages and cultures among those living and working in the Wirral, North West England.	2012-09-12 10:20:25	964047928015949824	2018-02-15 08:05:11	7	Teachers, here are some resources to help make your classes more aware of Chinese culture as we get ready to celebr https://t.co/aXLSSQsAg9	14732889	
964212344040644608	2018-02-15 18:58:31	0	RT @BritishCouncil: Teachers, here are some resources to help make your classes more aware of Chinese culture as we get ready to celebrate	850254868614848512	Johnson Simon	JohnsonSimon312	23	0	600	238	949		Nonprofits Government & Politics	2017-04-07 07:52:12	964047928015949824	2018-02-15 08:05:11	8	Teachers, here are some resources to help make your classes more aware of Chinese culture as we get ready to celebr https://t.co/aXLSSQsAg9	14732889	
964607900390961152	2018-02-16 21:10:19	0	Happy Chinese New Year! Today marks one of the biggest celebrations in Chinese culture and the beginning of the Yea https://t.co/3a2NRqMqQW	3254042239	UNT OSL	UNT_OSL	457	6	380	669	367	STUB 138, UNT	The Office of Spiritual Life at UNT is here to help students connect to spiritual resources, create space for interfaith engagement, and much more!	2015-06-23 21:33:41						
964092161405972480	2018-02-15 11:00:57	0	Chinese New Year Celebrations! Join in for an evening of Chinese culture as we celebrate Chinese New Year. We will https://t.co/cNyQNl4bz4	860479649008242688	Bagot Street	BagotStreet	44	0	103	43	96	Birmingham, England	Welcome to Bagot Street, Campus Living Villages. We'll keep you up to date with village life and answering your questions Mon-Fri 9am-5pm #LoveVillageLife	2017-05-05 13:01:50						
964177028013424640	2018-02-15 16:38:11	0	RT @leahpuyat1: Kung hei fat choy! Catholic means universal! Respecting the Chinese culture and uniting celebration with faith and sacrific	777103990446096384	Flor Sandoval	jonamheliza	69	0	27614	161	9049	Republic of the Philippines		2016-09-17 11:16:44	964117883478425600	2018-02-15 12:43:10	4	Kung hei fat choy! Catholic means universal! Respecting the Chinese culture and uniting celebration with faith and https://t.co/aeA3YmGyVb	737285205564628992	
964179578200698884	2018-02-15 16:48:19	0	It's Chinese New Year. Happy to have learned so much about the Chinese culture over the past two https://t.co/nrOj1Fnst6	86442481	Nikki Lubing	teachernikki_	189	16	977	238	116	Illinois, USA	My goal is to provide English lessons to people who cannot afford quality education. By ordering a t-shirt, you will fund an online course for my students.	2009-10-31 02:02:20						
964402774245982214	2018-02-16 07:35:13	0	RT @andrewrstine: &gt;a speculative fiction world where westerners are expected to know about chinese culture because china's middle class is	2789045124	.:the felidroid:.	farorenightclaw	501	17	29846	282	15594	Strangehouse, San Jose	31-yr-old agender furry artist, feminist, and ne'er-do-well. Pronouns: it/its. @droneriots for activism, @feedbackerror is AD.  @Rokuurok &  @goopypanther	2014-09-04 03:42:24	964376926440730624	2018-02-16 05:52:31	10	&gt;a speculative fiction world where westerners are expected to know about chinese culture because china's middle cla https://t.co/jTgEz0VGVg	50790536	
964413591297273856	2018-02-16 08:18:12	0	RT @CUPBookshop: Happy #ChineseNewYear.  If you'd like to learn more about Chinese festivals, our Introductions to Chinese Culture series i	404040651	Wolfson College	WolfsonCam	3088	59	1602	359	683	Cambridge	Wolfson College, University of Cambridge. Founded in 1965 and welcoming mature undergraduates, postgraduates and visiting academics from around the world.	2011-11-03 10:56:28	964412419903692800	2018-02-16 08:13:33	1	Happy #ChineseNewYear.  If you'd like to learn more about Chinese festivals, our Introductions to Chinese Culture s https://t.co/5jGZZ2lUOT	156304811	
964478052364439552	2018-02-16 12:34:21	0	We enjoyed reading this book and learning about the Chinese culture and the legend of the Nian Monster! Happy New Y https://t.co/Kqqua0iTpi	794364212185300992	storymamas	storymamas	626	10	1105	1021	2687		3 educator moms, 7 kids, 1 passion for literacy! As book lovers, we want to spread the love, so let us know if you'd like us to review your book!	2016-11-04 02:22:41						
964833155524870145	2018-02-17 12:05:24	0	LMAO politicians actually got offended by Namewee's like a dog mv? So much for learning our Chinese culture. It i https://t.co/Wvo7INYqDF	547587223	PJ 	jetyap1	771	8	55316	328	22586	ig: @jetyap1	not your average engineering student.	2012-04-07 12:57:25						
964553852308611073	2018-02-16 17:35:33	0	#Ambassades @FranceaChypre: RT @ParisJeTaime: Happy Lunar New Year from Paris!  Did you know that Chinese culture https://t.co/kqF6sx1Fp0	244013273	DiploMix	DiploMix	8688	2741	1021888	809	45		Agrgateur dactualits diplomatiques franaises. Timeline = actus web. Listes thmatiques = institutions diplomatiques sur Twitter.	2011-01-28 09:19:44						
964543022766739457	2018-02-16 16:52:31	0	RT @SwissArmy: Happy Chinese New Year! In Chinese culture, it is believed that dogs can bring happiness, wealth and prosperity to their own	462251110	Roundman 	PatriotIndiana	2166	409	166857	4894	14706	Patriot, Indiana 	@LiUNALocal741  @25ID   @DelMagueyMezcal  @Hank_III	2012-01-12 18:57:34	964541853939970049	2018-02-16 16:47:52	2	Happy Chinese New Year! In Chinese culture, it is believed that dogs can bring happiness, wealth and prosperity to https://t.co/GUL3aiO4Bf	29988042	
964540984376922112	2018-02-16 16:44:25	0	RT @MrsConway01: Enjoying our Chinese Food Tasting Session   Getting a first hand experience of the Chinese culture  @fcwpa https://	954386199300526080	Mrs Harwood	harwood_mrs	39	0	132	74	212	Fochriw, Wales	Fochriw Primary School | School Secretary | Parent Governor | One Team One Vision  -  I am not responsible for the tweets of my followers.	2018-01-19 16:12:56	964459573892599808	2018-02-16 11:20:55	1	Enjoying our Chinese Food Tasting Session   Getting a first hand experience of the Chinese culture  @fcwpa https://t.co/jpSDcuDSfn	4457722103	
964612652650717185	2018-02-16 21:29:12	0	RT @DrJohnMarro: .@JefffSquad on #Periscope: JeffSquad Tours presents the Chinese Culture &amp; Cuisine Festival in Phoenix AZ on @Peris https	744638555985575936	Edward Benjamin	PhilcamEdward	740	332	171803	28	2	/r/Livebroadcasting	#Livebroadcasting network. Media submitted right now, all over the internet. Follow us to promote confidence or visit our network site: http://www.philcam.im	2016-06-19 21:10:41	964609649977774081	2018-02-16 21:17:16	3	.@JefffSquad on #Periscope: JeffSquad Tours presents the Chinese Culture &amp; Cuisine Festival in Phoenix AZ on @Peris https://t.co/ajhwTkfaXE	720682286769967104	
964601868679774211	2018-02-16 20:46:21	0	Join us tonight to celebrate the Chinese Lunar New Year, hosted by the Chinese Club and Chinese Culture clubs! All https://t.co/qchXdzwGNo	331778637	WKU Chinese Flagship	WKUFlagship	388	6	444	197	226	Bowling Green, KY	The Chinese Language Flagship at WKU provides students the opportunity to become professionally proficient in Chinese, regardless of major or career goals.	2011-07-08 18:09:03						
964603203269677056	2018-02-16 20:51:39	0	RT @WKUFlagship: Join us tonight to celebrate the Chinese Lunar New Year, hosted by the Chinese Club and Chinese Culture clubs! All are wel	1646946595	Ryan Richardson 	rhinomite95	635	0	1530	542	1177	Bowling Green, KY	|WKU| progressive politics, puppies, and food porn | I have a list of celebrities I want to be best friends with and my tweets are hit or miss 	2013-08-05 04:55:45	964601868679774211	2018-02-16 20:46:21	1	Join us tonight to celebrate the Chinese Lunar New Year, hosted by the Chinese Club and Chinese Culture clubs! All https://t.co/qchXdzwGNo	331778637	
964655039791947776	2018-02-17 00:17:38	0	Let's celebrate by reading novels that gives us a glimpse into the amazing Chinese culture.... https://t.co/saPGrWsOKb	84105918	Otis Library	otis_library	1249	69	5772	955	728	Norwich, CT	We provide free and open access to information, ideas, and services that anticipate our communitys personal, educational, and professional needs.	2009-10-21 15:57:59						
964669359032430592	2018-02-17 01:14:32	0	JeffSquad Tours presents the Chinese Culture &amp; Cuisine Festival in #Phoenix AZ on @PeriscopeTV #culture https://t.co/sVQn9j7A4u	788101664070733824	ChineseAZ	ChineseAZ	4952	8	892	5406	1443	Phoenix, AZ	Demolishing #Phoenix Chinese Cultural Center by trueNorth companies would destroy an important piece of AZ's history. Help preserve #Chinese cultural heritage	2016-10-17 19:37:33						
964900163847417857	2018-02-17 16:31:40	0	RT @Harleys_Dream: Riley has always had an interest in Chinese culture (and Chinese medicine in particular) so she is especially excited ab	729353285606506496	ChihuahuaIsland	ChihuahuaIsland	2713	48	4503	5000	5678	Chihuaha Island	You've just been stranded on Chihuahua Island. An island inhabited only by... chihuahuas?! Actually, it's a chihuahua paradise! Welcome.	2016-05-08 16:52:28	964663677998608384	2018-02-17 00:51:58	10	Riley has always had an interest in Chinese culture (and Chinese medicine in particular) so she is especially excit https://t.co/YVq3dqBzhL	1462066418	
964888629301608449	2018-02-17 15:45:50	0	RT @BeijingPalmer: CGTN correspondent defends racist new year skit as 'Chinese culture,' attacks BBC. Remember, censorship culture doesn't	184913941	God's Own Monster	scabbyscribe56	379	52	80838	967	666	Philadelphia, PA	Worried man with a worried mind	2010-08-30 20:05:53	964873092257398790	2018-02-17 14:44:06	4	CGTN correspondent defends racist new year skit as 'Chinese culture,' attacks BBC. Remember, censorship culture doe https://t.co/nvd6t5PggR	1254412448	
964873605573234690	2018-02-17 14:46:08	0	RT @BeijingPalmer: CGTN correspondent defends racist new year skit as 'Chinese culture,' attacks BBC. Remember, censorship culture doesn't	15897424	Natasha Heller	nheller	2651	46	4927	1465	15189		Chinese religion and history, especially Buddhism.  Children's books for research and for fun, plus cooking and cats. RT =/= endorsement.	2008-08-18 22:43:16	964873092257398790	2018-02-17 14:44:06	1	CGTN correspondent defends racist new year skit as 'Chinese culture,' attacks BBC. Remember, censorship culture doe https://t.co/nvd6t5PggR	1254412448	
964770194165059585	2018-02-17 07:55:13	0	The magic of numbers in the Chinese culture https://t.co/dYO9IyVOZ0 #China #Travel https://t.co/dAdMrO7MT7	24875063	TaraGoldsmith	Best_of_Tara	19529	1046	76538	17833	8113	Planet Earth	#Travel to Learn, to Experience, to Share	2009-03-17 12:40:26						
964520096621187072	2018-02-16 15:21:25	0	RT @ParisJeTaime: Happy Lunar New Year from Paris!  Did you know that Chinese culture is visible in many areas of the city? For example,	1490979648	miwaaa	miwmiw7a	223	179	24014	231	9315			2013-06-07 18:21:19	964507900348641280	2018-02-16 14:32:57	9	Happy Lunar New Year from Paris!  Did you know that Chinese culture is visible in many areas of the city? For exa https://t.co/qm8wYhYRDK	292409371	
964782210564984832	2018-02-17 08:42:58	0	@carlbildt The world admires the Chinese culture and its philosophers. The world admires the Chinese Wall which pro https://t.co/fyWjRSU08r	4207737250	Jose	platfus125	248	13	17817	697	11731			2015-11-17 06:16:45						
964496075716374529	2018-02-16 13:45:58	0	@SouthSoundMag Quit using the Chinese culture	2351550392	Penny Octuck Cole	Rycher12Penny	149	6	1662	527	7169	Tacoma, WA	Social marketer; Modere	2014-02-19 11:34:47						
