id	created_at	retweet_count	text	user_id	user_name	user_screen_name	user_followers_count	user_listed_count	user_statuses_count	user_friends_count	user_favourites_count	user_location	user_desc	user_created_at	retweeted_status_id	retweeted_status_created_at	retweeted_status_retweet_count	retweeted_status_text	retweeted_status_user_id
991181932854632448	2018-05-01 05:06:02	0	RT @daumkeziah: To everyone causing so much negativity: I mean no disrespect to the Chinese culture. Im simply showing my appreciation to	1172614128	Reyes	reyaaaaas	231	4	17904	230	9583	Konohagakure	Time to change up	2013-02-12 17:38:38	990255923598786560	2018-04-28 15:46:24	7790	To everyone causing so much negativity: I mean no disrespect to the Chinese culture. Im simply showing my apprecia https://t.co/ByvuZ2b9VN	2842576303	
991182087657930754	2018-05-01 05:06:39	0	RT @daumkeziah: To everyone causing so much negativity: I mean no disrespect to the Chinese culture. Im simply showing my appreciation to	3219598122	Vets Mentoring Vets	VetsMentoring	4438	81	5807	4148	2709	United States	501(c)3 non-profit providing jobs for military veterans through education, training & hands on experience utilizing donations and grants	2015-05-18 18:29:02	990255923598786560	2018-04-28 15:46:24	7792	To everyone causing so much negativity: I mean no disrespect to the Chinese culture. Im simply showing my apprecia https://t.co/ByvuZ2b9VN	2842576303	
991181597499121664	2018-05-01 05:04:42	0	RT @daumkeziah: To everyone causing so much negativity: I mean no disrespect to the Chinese culture. Im simply showing my appreciation to	739483584	MrOctober1990	MrOctober1990	385	4	7381	1333	10209		#StlCards #GoVols #SEC #TitanUp #GritNGrind #Smashville #Duke #ACC	2012-08-06 00:07:11	990255923598786560	2018-04-28 15:46:24	7785	To everyone causing so much negativity: I mean no disrespect to the Chinese culture. Im simply showing my apprecia https://t.co/ByvuZ2b9VN	2842576303	
991931748681306114	2018-05-03 06:45:32	0	@daumkeziah You look gorgeous in that Chinese Dress. Chinese culture is inclusive and it's never wrong to wear some https://t.co/TpgbLlqvTN	388899797	nikedad	nikedad1	3	0	2	24	2			2011-10-11 14:40:44						
991931543353520129	2018-05-03 06:44:43	0	RT @daumkeziah: To everyone causing so much negativity: I mean no disrespect to the Chinese culture. Im simply showing my appreciation to	20922114	~Gaielle~ 	GaielleTalking	2881	0	14749	4716	21640	United States	Irish GalSupports #Trump #PATRIOT #deplorable #Cats#Dogs  #MAGA #infidel #INSTABLOCK No Lists #BuildTheWall	2009-02-15 17:19:04	990255923598786560	2018-04-28 15:46:24	9482	To everyone causing so much negativity: I mean no disrespect to the Chinese culture. Im simply showing my apprecia https://t.co/ByvuZ2b9VN	2842576303	
991194075289317376	2018-05-01 05:54:17	0	RT @daumkeziah: To everyone causing so much negativity: I mean no disrespect to the Chinese culture. Im simply showing my appreciation to	4395685513	Gisela?	_6isela_	248	1	1277	251	6834	Lost	 UT20 	2015-11-29 05:11:10	990255923598786560	2018-04-28 15:46:24	7887	To everyone causing so much negativity: I mean no disrespect to the Chinese culture. Im simply showing my apprecia https://t.co/ByvuZ2b9VN	2842576303	
991195656755687424	2018-05-01 06:00:34	0	RT @daumkeziah: To everyone causing so much negativity: I mean no disrespect to the Chinese culture. Im simply showing my appreciation to	76767066	LavesJoe	Lavesjoe	104	25	3758	466	393		Parent	2009-09-23 21:49:05	990255923598786560	2018-04-28 15:46:24	7894	To everyone causing so much negativity: I mean no disrespect to the Chinese culture. Im simply showing my apprecia https://t.co/ByvuZ2b9VN	2842576303	
991210911053565952	2018-05-01 07:01:11	0	@daumkeziah The dress is beautiful. You look beautiful. This is not an insult to Chinese culture. But this does sho https://t.co/71zfAlk2Fv	800027585887477760	Willow L Wretling	WillowLWretling	657	0	584	1066	258	New York, NY	Proud Progressive, Teacher, Believer In Democracy. Trumps Not My President, Sick of the Ignorant Cult45, Need Sensible Gun Laws, No Tolerance for the Alt Right	2016-11-19 17:26:55						
991212198990041088	2018-05-01 07:06:18	0	RT @daumkeziah: To everyone causing so much negativity: I mean no disrespect to the Chinese culture. Im simply showing my appreciation to	213560152		GRUDGERODRIGUEZ	291	21	24550	143	14570	California, USA	Discrimination of race, race baiting, and pandering to minorities are all forms of racism. Dont truss it!!!	2010-11-09 06:41:24	990255923598786560	2018-04-28 15:46:24	7962	To everyone causing so much negativity: I mean no disrespect to the Chinese culture. Im simply showing my apprecia https://t.co/ByvuZ2b9VN	2842576303	
991198035156852736	2018-05-01 06:10:01	0	RT @daumkeziah: To everyone causing so much negativity: I mean no disrespect to the Chinese culture. Im simply showing my appreciation to	2347181874	Marcus Steele	Jormahoo	60	2	1133	205	10962	Suomi	Finnish gamer and game developer. Also I make music and draw. I like anime and movies. (l'm not really called Marcus hes fictional for safety)	2014-02-16 17:28:08	990255923598786560	2018-04-28 15:46:24	7905	To everyone causing so much negativity: I mean no disrespect to the Chinese culture. Im simply showing my apprecia https://t.co/ByvuZ2b9VN	2842576303	
991923276657168384	2018-05-03 06:11:52	0	@myajasminee @GamerWithAHardR The people of China ARE Chinese and ARE the Chinese culture. They own the copyright.	310640708	NNman	AnnoyinglyYours	123	23	27106	37	626	United States	Just dancing through life	2011-06-04 03:09:12						
991185267095687168	2018-05-01 05:19:17	0	RT @daumkeziah: To everyone causing so much negativity: I mean no disrespect to the Chinese culture. Im simply showing my appreciation to	868137100331405313	P00DS	LeTommyWiseau	74	0	3955	590	9579	Estados Unidos	@pewdiepie love me plz	2017-05-26 16:09:48	990255923598786560	2018-04-28 15:46:24	7817	To everyone causing so much negativity: I mean no disrespect to the Chinese culture. Im simply showing my apprecia https://t.co/ByvuZ2b9VN	2842576303	
991203500376973312	2018-05-01 06:31:44	0	RT @daumkeziah: To everyone causing so much negativity: I mean no disrespect to the Chinese culture. Im simply showing my appreciation to	3401033417	NoahJ  [ Team ]	Wicketkeeper29	21	0	1277	129	399			2015-08-03 08:05:07	990255923598786560	2018-04-28 15:46:24	7936	To everyone causing so much negativity: I mean no disrespect to the Chinese culture. Im simply showing my apprecia https://t.co/ByvuZ2b9VN	2842576303	
991850496653602817	2018-05-03 01:22:40	0	RT @daumkeziah: To everyone causing so much negativity: I mean no disrespect to the Chinese culture. Im simply showing my appreciation to	152865505	RoguePatriot	miteaswelltrump	1273	4	7469	2719	17313	Earth	Recently freed from the liberal dystopia of San Francisco. Small business owner. Patriot.	2010-06-07 02:35:33	990255923598786560	2018-04-28 15:46:24	9375	To everyone causing so much negativity: I mean no disrespect to the Chinese culture. Im simply showing my apprecia https://t.co/ByvuZ2b9VN	2842576303	
991192619748294657	2018-05-01 05:48:30	0	RT @daumkeziah: To everyone causing so much negativity: I mean no disrespect to the Chinese culture. Im simply showing my appreciation to	2986097249	Ben Davis	bwdavis22	303	14	8360	684	5967	Asheville, NC 	Video Games Gamertag: PalmArnold xbox & ps. I browse twitter for gaming news and tech. I believe in Jesus. Be Excellent to each other	2015-01-19 17:49:21	990255923598786560	2018-04-28 15:46:24	7873	To everyone causing so much negativity: I mean no disrespect to the Chinese culture. Im simply showing my apprecia https://t.co/ByvuZ2b9VN	2842576303	
991955782185967616	2018-05-03 08:21:02	0	@TimRunsHisMouth The ultimate compliment to the Chinese culture, &amp; big to her SJW virtue signaling critics. Win win	62465724	Lauren Michero	WDWandFashion	728	35	24386	1046	42439	Texas	I like all things President Trump, Conservative, Outlander, Victoria, GOT, Poldark, and Disney related. Ill likely offend most Democrats lol	2009-08-03 07:53:27						
991192284547829765	2018-05-01 05:47:10	0	RT @daumkeziah: To everyone causing so much negativity: I mean no disrespect to the Chinese culture. Im simply showing my appreciation to	835670628	Paul Newell	PaulNewell4	850	156	125479	97	129831	Manhattan Beach, CA	Musician - Composer -  Recording /Mixing Engineer -  Audio Producer - This is my ONLY twitter Account	2012-09-20 14:22:33	990255923598786560	2018-04-28 15:46:24	7868	To everyone causing so much negativity: I mean no disrespect to the Chinese culture. Im simply showing my apprecia https://t.co/ByvuZ2b9VN	2842576303	
991952384535465984	2018-05-03 08:07:32	0	RT @BretWeinstein: Chinese culture regards appropriation of Chinese culture as appropriate. Prohibitions on appropriation render the approp	603113252	Scott McCarty	audi_scott_mc	84	0	478	228	1132	Dallas, TX		2012-06-08 22:27:26	991770373275336705	2018-05-02 20:04:17	395	Chinese culture regards appropriation of Chinese culture as appropriate. Prohibitions on appropriation render the a https://t.co/smuj3dH3Zd	78683448	
991259783436128257	2018-05-01 10:15:23	0	RT @daumkeziah: To everyone causing so much negativity: I mean no disrespect to the Chinese culture. Im simply showing my appreciation to	871540198429138945	Maria V	MVirginia82	470	0	14695	320	24002	Florida		2017-06-05 01:32:30	990255923598786560	2018-04-28 15:46:24	8086	To everyone causing so much negativity: I mean no disrespect to the Chinese culture. Im simply showing my apprecia https://t.co/ByvuZ2b9VN	2842576303	
991256897670938624	2018-05-01 10:03:55	0	RT @LadyLiberation_: An sjw bullying a teenager because she's appropriating Chinese culture. Someone wearing a dress is oppressive to h	103546842	Rikza Novita	rikzanovita	647	2	38132	317	513	7th floor, Gryffindor Tower	Dont follow me, just follow your heart.	2010-01-10 11:26:08	990768809484185601	2018-04-30 01:44:26	365	An sjw bullying a teenager because she's appropriating Chinese culture. Someone wearing a dress is oppressive t https://t.co/yCX1UZG8AM	4105205369	
991265566873866241	2018-05-01 10:38:22	0	RT @daumkeziah: To everyone causing so much negativity: I mean no disrespect to the Chinese culture. Im simply showing my appreciation to	1829067445	Su from NYC 	Sexy_Bunny_98	358	19	92395	110	21	New York, USA	  .	2013-09-08 13:19:32	990255923598786560	2018-04-28 15:46:24	8104	To everyone causing so much negativity: I mean no disrespect to the Chinese culture. Im simply showing my apprecia https://t.co/ByvuZ2b9VN	2842576303	
991269090751864832	2018-05-01 10:52:22	0	RT @daumkeziah: To everyone causing so much negativity: I mean no disrespect to the Chinese culture. Im simply showing my appreciation to	920721635249983498	Ev Under	EveUnder7	38	0	2883	35	2617	United States	Truth Cannon	2017-10-18 18:41:58	990255923598786560	2018-04-28 15:46:24	8116	To everyone causing so much negativity: I mean no disrespect to the Chinese culture. Im simply showing my apprecia https://t.co/ByvuZ2b9VN	2842576303	
991257497485893632	2018-05-01 10:06:18	0	RT @daumkeziah: To everyone causing so much negativity: I mean no disrespect to the Chinese culture. Im simply showing my appreciation to	3300631313	Tiller of the Ground, Loser of the Pound	Odder_n_otter	383	2	8533	1280	43481	Villa della Ottere, Ohio, USA	A better Catholic than Julius III, I gaze in the dirt professionally whilst my soul cries to the heavens. Geologist. Never been cool, don't intend to start	2015-05-27 17:09:54	990255923598786560	2018-04-28 15:46:24	8077	To everyone causing so much negativity: I mean no disrespect to the Chinese culture. Im simply showing my apprecia https://t.co/ByvuZ2b9VN	2842576303	
991255928883367939	2018-05-01 10:00:04	0	RT @daumkeziah: To everyone causing so much negativity: I mean no disrespect to the Chinese culture. Im simply showing my appreciation to	158610503	Jules	JulesPSpencer	1900	74	47982	1911	2061	Living in the library of Highclere Castle	#IStandwithIsrael  #NeverHillary	2010-06-23 04:10:09	990255923598786560	2018-04-28 15:46:24	8072	To everyone causing so much negativity: I mean no disrespect to the Chinese culture. Im simply showing my apprecia https://t.co/ByvuZ2b9VN	2842576303	
991262190702399489	2018-05-01 10:24:57	0	Chinese Culture Day  In  The Pak China Academy North Nazimabad Block B opp Kababjeee	146365775	Aamir Wasti	Uwasti	21	1	1487	5	0	Karachi		2010-05-21 07:30:25						
991220298153447424	2018-05-01 07:38:29	0	RT @daumkeziah: To everyone causing so much negativity: I mean no disrespect to the Chinese culture. Im simply showing my appreciation to	409596990	f  	OfficiallyR0yal	1322	6	18934	893	12981	Maryland, USA	February 14th   Pageant Girl Morgan State 20  Youtube || Infinity Navarro  706443	2011-11-10 23:46:28	990255923598786560	2018-04-28 15:46:24	7987	To everyone causing so much negativity: I mean no disrespect to the Chinese culture. Im simply showing my apprecia https://t.co/ByvuZ2b9VN	2842576303	
991300589307990018	2018-05-01 12:57:32	0	RT @daumkeziah: To everyone causing so much negativity: I mean no disrespect to the Chinese culture. Im simply showing my appreciation to	2344926979	Nuwanda	MattLegit10	1124	38	87589	2995	280640		It matters not how strait the gate, How charged with punishments the scroll, I am the master of my fate: I am the Captain of my soul. STL  Louisville #KiaKaha	2014-02-15 10:31:07	990255923598786560	2018-04-28 15:46:24	8246	To everyone causing so much negativity: I mean no disrespect to the Chinese culture. Im simply showing my apprecia https://t.co/ByvuZ2b9VN	2842576303	
993422286576205824	2018-05-07 09:28:24	0	@XHNews only love @KrisWu as he is constantly exporting Chinese culture to the world. https://t.co/jASIuQKBzO	917583021250830338	Hilary Huang	HilaryHuang6	21	0	510	69	1343	, 	You will be defined not just by what you achievebut by how you survive.	2017-10-10 02:50:14						
991361054482415617	2018-05-01 16:57:48	0	what she did was bring more attention to the chinese culture. if anyone thinks otherwise i accept it. i just had to https://t.co/4vFVP79xAQ	409928675	ok	iamreptor	1619	3	11386	609	2328			2011-11-11 12:10:04						
993424493124243456	2018-05-07 09:37:10	0	RT @BenedicteKing: I feel like I need to add some more positive to this thread. Chinese culture and most Chinese people are fantastic in ma	462832414	Nice For What?	LaurakinsTrain	1688	44	220202	444	5477	Johannesburg || Secunda	Founder of @ShieldHarbour || 1/3 of @ChitiGirls || Writer || God is Able	2012-01-13 12:15:21	993184498819870720	2018-05-06 17:43:31	12	I feel like I need to add some more positive to this thread. Chinese culture and most Chinese people are fantastic https://t.co/oZpzMJuodZ	3113345355	
993240312016461825	2018-05-06 21:25:18	0	RT @legendre007: *Mary Sue* moves the goal posts. Jeremy Lam's initial accusation was that the dress disrespected Chinese culture in genera	985483598	Fiddler Forest	FiddlerForest	344	35	41989	180	81017	Lost in Thought	Ex-Navy Nuke, EE, @UEvansville @TKE_Fraternity Alum. Lazarus Clan Paterfamilias; Bridgeburner; Phoenix	2012-12-02 22:19:42	993067293495062528	2018-05-06 09:57:47	14	*Mary Sue* moves the goal posts. Jeremy Lam's initial accusation was that the dress disrespected Chinese culture in https://t.co/LhyWtrYMWO	104790170	
992920958313877504	2018-05-06 00:16:18	0	RT @daumkeziah: To everyone causing so much negativity: I mean no disrespect to the Chinese culture. Im simply showing my appreciation to	864194919186956290	President Ben Shapiro	BenForPresident	81	2	1039	165	1547	America 	BENNNN SHAPPPPPPPPIIIROOO	2017-05-15 19:04:59	990255923598786560	2018-04-28 15:46:24	9897	To everyone causing so much negativity: I mean no disrespect to the Chinese culture. Im simply showing my apprecia https://t.co/ByvuZ2b9VN	2842576303	
992924733288206338	2018-05-06 00:31:18	0	@FreeTalkLive I think Mr Lam, the owner of the Chinese culture, never got a prom date. Bitter hater in need of therapy perhaps??	2806659060	Lora Burke-Mulkey	LoraEllen58	47	0	672	178	24	Kokomo, IN		2014-09-13 03:54:39						
993314740603531264	2018-05-07 02:21:03	0	Its important in the Chinese culture (but it doesnt mean only Chinese people can wear the dress just saying).	871445967702183936	Eva.	vaeoongh	0	0	34	33	22			2017-06-04 19:18:04						
993304660818649088	2018-05-07 01:41:00	0	RT @daumkeziah: To everyone causing so much negativity: I mean no disrespect to the Chinese culture. Im simply showing my appreciation to	161830552	Catherine	ppatiently	2271	5	2204	646	1250			2010-07-01 22:18:45	990255923598786560	2018-04-28 15:46:24	9966	To everyone causing so much negativity: I mean no disrespect to the Chinese culture. Im simply showing my apprecia https://t.co/ByvuZ2b9VN	2842576303	
993378632625078273	2018-05-07 06:34:56	0	RT @QogBazar: Lessons about traditional Chinese culture influence both the behavior and mind of the students from Hejing No.3 Middle School	790244079778930689	2018 Year for Peace	feralislandBud	11343	242	213335	12439	142618	Russell Island, Queensland, Australia	Travel art photography music laughter    NO drugs booze corruption porn DM. racism ,or neighbours from hell redland city council are a waste of oxygen.	2016-10-23 17:30:45	993375387873722370	2018-05-07 06:22:03	3	Lessons about traditional Chinese culture influence both the behavior and mind of the students from Hejing No.3 Mid https://t.co/qXFiz706Hc	814792022917718016	
993383506255458304	2018-05-07 06:54:18	0	RT @OBORCHINA: #ChineseCulture and Cuisine Event Held in #NewYork City, #US. https://t.co/33jH7riHpf	991575826364690432	Zhang Li	GrandSilkRoad	34	0	100	46	114	Shaanxi	Tour services throughout the Ancient Silk Road. Email: info@discovershaanxi.com	2018-05-02 07:11:14	993380056876683264	2018-05-07 06:40:36	2	#ChineseCulture and Cuisine Event Held in #NewYork City, #US. https://t.co/33jH7riHpf	791700218379108355	
993380067030990849	2018-05-07 06:40:38	0	RT @QogBazar: Lessons about traditional Chinese culture influence both the behavior and mind of the students from Hejing No.3 Middle School	2398336412	Tammy	tv_tammy	8554	375	183347	9405	186368		IF YOU ARE ASHAMED OF IT~~~DON'T DO IT!!! 	2014-03-19 19:17:18	993375387873722370	2018-05-07 06:22:03	4	Lessons about traditional Chinese culture influence both the behavior and mind of the students from Hejing No.3 Mid https://t.co/qXFiz706Hc	814792022917718016	
993049161284182016	2018-05-06 08:45:44	0	@razibkhan @TheMarySue The central point is mad. If pretty white girls adopt aspects of Chinese culture then racism https://t.co/KFeQtSwcNh	47023210	James Moughan	jamougha	46	2	1402	189	744	United Kingdom	Nerd.	2009-06-14 03:23:29						
993339054983917569	2018-05-07 03:57:40	0	@mustbdem @p0larheart @iwnt2kms @valesmom @daumkeziah @leslieberland Actually the Chinese culture has appropriated https://t.co/Adzrl62OW2	846494436104327168	Justin Lombardi	Bombardier228	37	6	29	165	468	Prospect Park, PA	I am a guy who has no idea how to use twitter at all. That's descriptive enough right?	2017-03-27 22:49:35						
993117754680111106	2018-05-06 13:18:18	0	RT @veedzo: look at all these people who aren't Chinese trying to work out if something is cultural appropriating Chinese culture or not wh	2369399436		madah_xo	377	24	65832	180	570		18 | paki | black lives matter | free palestine | would die 4 taehyung, chengcheng & jungwoo	2014-03-02 21:20:05	993095200359763969	2018-05-06 11:48:41	19	look at all these people who aren't Chinese trying to work out if something is cultural appropriating Chinese cultu https://t.co/dWHgdOrVHN	3989360177	
993131138947473408	2018-05-06 14:11:29	0	RT @legendre007: *Mary Sue* moves the goal posts. Jeremy Lam's initial accusation was that the dress disrespected Chinese culture in genera	150030339	Mark	tehyuki	122	4	3756	444	88			2010-05-30 22:08:41	993067293495062528	2018-05-06 09:57:47	5	*Mary Sue* moves the goal posts. Jeremy Lam's initial accusation was that the dress disrespected Chinese culture in https://t.co/LhyWtrYMWO	104790170	
993133428848590848	2018-05-06 14:20:35	0	RT @veedzo: look at all these people who aren't Chinese trying to work out if something is cultural appropriating Chinese culture or not wh	596617988	alima	Adriana_giwa	892	6	43944	587	10985	London, England	to be or not to be a bad bitch.	2012-06-01 16:52:18	993095200359763969	2018-05-06 11:48:41	28	look at all these people who aren't Chinese trying to work out if something is cultural appropriating Chinese cultu https://t.co/dWHgdOrVHN	3989360177	
993125153067421696	2018-05-06 13:47:42	0	RT @veedzo: look at all these people who aren't Chinese trying to work out if something is cultural appropriating Chinese culture or not wh	906513101578784768	Blessed 	SnowDesi	511	5	50354	1022	107232	Planet Earth	20 | Desi | Men are trash | #JusticeForGrenfell | #HandsOffSyria |She/They | Backup @snowydesi |	2017-09-09 13:42:20	993095200359763969	2018-05-06 11:48:41	23	look at all these people who aren't Chinese trying to work out if something is cultural appropriating Chinese cultu https://t.co/dWHgdOrVHN	3989360177	
993484579989270528	2018-05-07 13:35:56	0	first of all, why is there black ppl speaking on appropriation of Chinese culture.  Also blonde hair is not appropr https://t.co/3i8gSzs1ie	211924150	Tori.	dontcallmetori_	450	3	5229	431	10898	out getting ribs	cant find love so searching for a sugar daddy instead cos at least that pays my bills.	2010-11-04 17:15:05						
993466913748635648	2018-05-07 12:25:44	0	RT @BenedicteKing: I feel like I need to add some more positive to this thread. Chinese culture and most Chinese people are fantastic in ma	207076657	Marine44	BantuMarine	174	1	24884	127	1471	City of Tshwane - South Africa	2009 deleted account holder	2010-10-24 13:20:40	993184498819870720	2018-05-06 17:43:31	13	I feel like I need to add some more positive to this thread. Chinese culture and most Chinese people are fantastic https://t.co/oZpzMJuodZ	3113345355	
993037970792828933	2018-05-06 08:01:16	0	RT @daumkeziah: To everyone causing so much negativity: I mean no disrespect to the Chinese culture. Im simply showing my appreciation to	2668341553	Texas DOOM Head	JohnnyPedro22	757	6	25133	938	32460	Burleson	US Soldier//I'm just kinda different man//Irish-Mexican	2014-07-22 03:57:00	990255923598786560	2018-04-28 15:46:24	9925	To everyone causing so much negativity: I mean no disrespect to the Chinese culture. Im simply showing my apprecia https://t.co/ByvuZ2b9VN	2842576303	
993408689305538560	2018-05-07 08:34:22	0	RT @Joannechocolat: Wong spent the next year touring China, visiting her family's ancestral village and studying Chinese culture. In the la	249236062	Ming Ho	Minghowriter	3474	166	71516	3155	21671	London	Writer. @neversaidplay #wggbawards Best Radio Drama 2018 #Three @WYPlayhouse #SchlafNicht @LAMDAdrama https://t.co/i92sZQXFgd https://t.co/JQlU7Afxmw	2011-02-08 17:00:33	993407428606808064	2018-05-07 08:29:22	1	Wong spent the next year touring China, visiting her family's ancestral village and studying Chinese culture. In th https://t.co/DiZXTLMTz0	131223120	
993365116774055936	2018-05-07 05:41:14	0	U.S. students embrace Chinese culture in NYC https://t.co/6QxO96miOX American students participate in a Chinese cul https://t.co/19O8arXsvT	599026769	Guangming Daily	Guangming_Daily	252302	123	8158	19	138	Beijing, China	Follow us to discover beautiful landscapes and typical lifestyles in China.	2012-06-04 07:34:01						
993256917798739968	2018-05-06 22:31:17	0	RT @daumkeziah: To everyone causing so much negativity: I mean no disrespect to the Chinese culture. Im simply showing my appreciation to	1099543634	Aubrey	AubreyBorge1	226	0	3027	148	14233		SC and Insta: aubreyborge	2013-01-17 23:37:34	990255923598786560	2018-04-28 15:46:24	9962	To everyone causing so much negativity: I mean no disrespect to the Chinese culture. Im simply showing my apprecia https://t.co/ByvuZ2b9VN	2842576303	
992859016664616961	2018-05-05 20:10:10	0	RT @daumkeziah: To everyone causing so much negativity: I mean no disrespect to the Chinese culture. Im simply showing my appreciation to	2469326141	NickAtNite	TheGamerMedic	95	1	348	7	2507	New York, USA	The 	2014-04-08 11:03:11	990255923598786560	2018-04-28 15:46:24	9880	To everyone causing so much negativity: I mean no disrespect to the Chinese culture. Im simply showing my apprecia https://t.co/ByvuZ2b9VN	2842576303	
992883390377578496	2018-05-05 21:47:01	0	RT @daumkeziah: To everyone causing so much negativity: I mean no disrespect to the Chinese culture. Im simply showing my appreciation to	926096432758755328	tessa	SmithTessaMarie	8	0	428	123	562	United States		2017-11-02 14:39:30	990255923598786560	2018-04-28 15:46:24	9888	To everyone causing so much negativity: I mean no disrespect to the Chinese culture. Im simply showing my apprecia https://t.co/ByvuZ2b9VN	2842576303	
993184498819870720	2018-05-06 17:43:31	0	I feel like I need to add some more positive to this thread. Chinese culture and most Chinese people are fantastic https://t.co/oZpzMJuodZ	3113345355	Bndicte  	BenedicteKing	1598	25	5873	354	2109	Beijing, China	Congolese  | 22 | BA, @KCL| MSc, Development @SciencesPo | LLM, I.R.(China-Africa) @Peking_Uni  | I write & make dope PPTs on my free time	2015-03-25 06:17:00						
993067293495062528	2018-05-06 09:57:47	0	*Mary Sue* moves the goal posts. Jeremy Lam's initial accusation was that the dress disrespected Chinese culture in https://t.co/LhyWtrYMWO	104790170	Stuart Hayashi 	legendre007	2610	165	65444	4079	28760	Honolulu, Hawaii	Irrepressibly devoted.	2010-01-14 11:56:58						
